2026-01-15 20:12:11,868 - INFO - Log file created: logs/scheduler_2026-01-15_20-12-11.log
2026-01-15 20:12:11,931 - INFO - Connected to PostgreSQL: f319_data
2026-01-15 20:12:11,968 - INFO - Adding job tentatively -- it will be properly scheduled when the scheduler starts
2026-01-15 20:12:11,969 - INFO - 📅 Full Crawler scheduled daily at 02:00
2026-01-15 20:12:11,969 - INFO - Adding job tentatively -- it will be properly scheduled when the scheduler starts
2026-01-15 20:12:11,969 - INFO -  Hybrid Crawler scheduled every 4 hours
2026-01-15 20:12:11,970 - INFO - Added job "Full Crawler Daily Job" to job store "default"
2026-01-15 20:12:11,970 - INFO - Added job "Hybrid Crawler Interval Job" to job store "default"
2026-01-15 20:12:11,970 - INFO - Scheduler started
2026-01-15 20:12:11,971 - INFO -  Scheduler started successfully
2026-01-15 20:12:11,971 - INFO - 📋 Hybrid Crawler Interval Job: next run at 2026-01-16 00:12:11.969439+07:00
2026-01-15 20:12:11,971 - INFO - 📋 Full Crawler Daily Job: next run at 2026-01-16 02:00:00+07:00
2026-01-15 20:12:11,971 - INFO - 🚀 Running initial hybrid crawler...
2026-01-15 20:12:11,971 - INFO - 🚀 Starting Hybrid Crawler job...
2026-01-15 20:12:11,971 - INFO - ====== WebDriver manager ======
2026-01-15 20:12:13,594 - INFO - Get LATEST chromedriver version for google-chrome
2026-01-15 20:12:14,304 - INFO - Get LATEST chromedriver version for google-chrome
2026-01-15 20:12:15,158 - INFO - Driver [C:\Users\admin\.wdm\drivers\chromedriver\win64\143.0.7499.192\chromedriver-win32/chromedriver.exe] found in cache
2026-01-15 20:12:16,388 - INFO - Selenium driver started
2026-01-15 20:12:16,389 - INFO - ang load trang (New posts)...
2026-01-15 20:12:23,161 - INFO - ✓ URL có pagination: https://f319.com/find-new/posts
2026-01-15 20:12:23,162 - INFO - Sử dụng URL: https://f319.com/find-new/posts
2026-01-15 20:12:23,162 - INFO - ang xử lý trang 1
2026-01-15 20:12:25,208 - INFO - Tìm thấy 20 threads trên trang 1
2026-01-15 20:12:32,080 - INFO - ã thu thập thông tin 20 threads, bắt đầu crawl posts...
2026-01-15 20:12:32,095 - INFO - [1/20] Crawl thread: HID sẽ lại X5 từ vùng giá 4.x ???...
2026-01-15 20:12:32,096 - INFO - [2/20] Crawl thread: BIDV chào bán riêng lẻ với giá 38,900 đồng/cp...
2026-01-15 20:12:35,207 - INFO - [Thread 1943821] Existing thread, crawling reverse 9→1 until last_post_id: post-47879171
2026-01-15 20:12:35,503 - INFO - [Thread 1943407] Existing thread, crawling reverse 20→1 until last_post_id: post-47879127
2026-01-15 20:12:37,798 - INFO - [Thread 1943407] Found last_post_id at page 20, stopping...
2026-01-15 20:12:37,824 - INFO - [Thread 1943407] Final batch inserted 1/1 posts
2026-01-15 20:12:37,827 - INFO - [Thread 1943407] Collected 1 posts in 5.7s
2026-01-15 20:12:37,828 - INFO - Thu thập được 1 posts từ thread
2026-01-15 20:12:37,834 - INFO - [3/20] Crawl thread: 6LON_banks(3/4 Big.Banks)Bơm máo,dùng hết ko Ae?...
2026-01-15 20:12:40,213 - INFO - [Thread 1943267] Existing thread, crawling reverse 42→1 until last_post_id: post-47879129
2026-01-15 20:12:40,876 - INFO - [Thread 1943821] Found last_post_id at page 8, stopping...
2026-01-15 20:12:40,884 - INFO - [Thread 1943821] Final batch inserted 3/3 posts
2026-01-15 20:12:40,887 - INFO - [Thread 1943821] Collected 3 posts in 8.8s
2026-01-15 20:12:40,888 - INFO - Thu thập được 3 posts từ thread
2026-01-15 20:12:40,891 - INFO - [4/20] Crawl thread: ánh giá thị trưng!...
2026-01-15 20:12:43,270 - INFO - [Thread 1941133] Existing thread, crawling reverse 26→1 until last_post_id: post-47879173
2026-01-15 20:12:44,957 - INFO - [Thread 1943267] Found last_post_id at page 41, stopping...
2026-01-15 20:12:44,962 - INFO - [Thread 1943267] Final batch inserted 2/2 posts
2026-01-15 20:12:44,964 - INFO - [Thread 1943267] Collected 2 posts in 7.1s
2026-01-15 20:12:44,964 - INFO - Thu thập được 2 posts từ thread
2026-01-15 20:12:44,967 - INFO - [5/20] Crawl thread: Ngành cao su (GVR, PHR,...) và NQ79...
2026-01-15 20:12:45,549 - INFO - [Thread 1941133] Found last_post_id at page 26, stopping...
2026-01-15 20:12:45,556 - INFO - [Thread 1941133] Final batch inserted 2/2 posts
2026-01-15 20:12:45,557 - INFO - [Thread 1941133] Collected 2 posts in 4.7s
2026-01-15 20:12:45,558 - INFO - Thu thập được 2 posts từ thread
2026-01-15 20:12:45,561 - INFO - [6/20] Crawl thread: Ngôi nhà nh trên Thảo Nguyên - P86...
2026-01-15 20:12:47,276 - INFO - [Thread 1943285] Existing thread, crawling reverse 6→1 until last_post_id: post-47879163
2026-01-15 20:12:47,916 - INFO - [Thread 1942185] Existing thread, crawling reverse 527→1 until last_post_id: post-47879179
2026-01-15 20:12:49,683 - INFO - [Thread 1943285] Found last_post_id at page 6, stopping...
2026-01-15 20:12:49,688 - INFO - [Thread 1943285] Final batch inserted 1/1 posts
2026-01-15 20:12:49,689 - INFO - [Thread 1943285] Collected 1 posts in 4.7s
2026-01-15 20:12:49,690 - INFO - Thu thập được 1 posts từ thread
2026-01-15 20:12:49,692 - INFO - [7/20] Crawl thread: BSR tin mặt 42.000 tỷ, chia cổ tức 61,5%, bóng dá...
2026-01-15 20:12:50,510 - INFO - [Thread 1942185] Found last_post_id at page 527, stopping...
2026-01-15 20:12:50,517 - INFO - [Thread 1942185] Final batch inserted 2/2 posts
2026-01-15 20:12:50,518 - INFO - [Thread 1942185] Collected 2 posts in 5.0s
2026-01-15 20:12:50,519 - INFO - Thu thập được 2 posts từ thread
2026-01-15 20:12:50,521 - INFO - [8/20] Crawl thread: HDB- Tiếp tục hành trình chinh phục những đỉnh cao...
2026-01-15 20:12:52,249 - INFO - [Thread 1927427] Existing thread, crawling reverse 70→1 until last_post_id: post-47879191
2026-01-15 20:12:52,841 - INFO - [Thread 1943915] Existing thread, crawling reverse 3→1 until last_post_id: post-47879189
2026-01-15 20:12:54,601 - INFO - [Thread 1927427] Found last_post_id at page 70, stopping...
2026-01-15 20:12:54,601 - INFO - [Thread 1927427] Collected 0 posts in 4.9s
2026-01-15 20:12:54,602 - INFO - Thu thập được 0 posts từ thread
2026-01-15 20:12:54,605 - INFO - [9/20] Crawl thread: BBC: Chia cổ tức kỷ lục 373,5%...
2026-01-15 20:12:55,186 - INFO - [Thread 1943915] Found last_post_id at page 3, stopping...
2026-01-15 20:12:55,187 - INFO - [Thread 1943915] Collected 0 posts in 4.7s
2026-01-15 20:12:55,187 - INFO - Thu thập được 0 posts từ thread
2026-01-15 20:12:55,191 - INFO - [10/20] Crawl thread: MBB đã v vùng giá mơ ước...
2026-01-15 20:12:57,017 - INFO - [Thread 1943807] Existing thread, crawling reverse 4→1 until last_post_id: post-47879187
2026-01-15 20:12:57,486 - INFO - [Thread 1936289] Existing thread, crawling reverse 24→1 until last_post_id: post-47858815
2026-01-15 20:12:59,312 - INFO - [Thread 1943807] Found last_post_id at page 4, stopping...
2026-01-15 20:12:59,313 - INFO - [Thread 1943807] Collected 0 posts in 4.7s
2026-01-15 20:12:59,314 - INFO - Thu thập được 0 posts từ thread
2026-01-15 20:12:59,316 - INFO - [11/20] Crawl thread: NNC - Siêu cổ phiếu ngành đá tăng trưởng rất mạnh ...
2026-01-15 20:12:59,845 - INFO - [Thread 1936289] Found last_post_id at page 24, stopping...
2026-01-15 20:12:59,846 - INFO - [Thread 1936289] Collected 0 posts in 4.7s
2026-01-15 20:12:59,847 - INFO - Thu thập được 0 posts từ thread
2026-01-15 20:12:59,850 - INFO - [12/20] Crawl thread: EIB mã duy nhất đi ngược thị trưng hôm nay...
2026-01-15 20:13:01,708 - INFO - [Thread 1927077] Existing thread, crawling reverse 31→1 until last_post_id: post-47868727
2026-01-15 20:13:02,303 - INFO - [Thread 1943887] Existing thread, crawling reverse 1→1 until last_post_id: post-47879157
2026-01-15 20:13:04,086 - INFO - [Thread 1927077] Found last_post_id at page 31, stopping...
2026-01-15 20:13:04,087 - INFO - [Thread 1927077] Collected 0 posts in 4.8s
2026-01-15 20:13:04,088 - INFO - Thu thập được 0 posts từ thread
2026-01-15 20:13:04,092 - INFO - [13/20] Crawl thread: Các trụ VN30 sắp tới cổ phiếu nào lên được chú ý !...
2026-01-15 20:13:05,073 - INFO - [Thread 1943887] Found last_post_id at page 1, stopping...
2026-01-15 20:13:05,074 - INFO - [Thread 1943887] Collected 0 posts in 5.2s
2026-01-15 20:13:05,075 - INFO - Thu thập được 0 posts từ thread
2026-01-15 20:13:05,079 - INFO - [14/20] Crawl thread: Thanh khoản...
2026-01-15 20:13:06,559 - INFO - [Thread 1943809] Existing thread, crawling reverse 1→1 until last_post_id: post-47879151
2026-01-15 20:13:07,483 - INFO - [Thread 1943459] Existing thread, crawling reverse 7→1 until last_post_id: post-47879149
2026-01-15 20:13:08,930 - INFO - [Thread 1943809] Found last_post_id at page 1, stopping...
2026-01-15 20:13:08,932 - INFO - [Thread 1943809] Collected 0 posts in 4.8s
2026-01-15 20:13:08,933 - INFO - Thu thập được 0 posts từ thread
2026-01-15 20:13:08,938 - INFO - [15/20] Crawl thread: Nhận định vnindex, cổ phiêu tât cả cac nho...
2026-01-15 20:13:10,037 - INFO - [Thread 1943459] Found last_post_id at page 7, stopping...
2026-01-15 20:13:10,038 - INFO - [Thread 1943459] Collected 0 posts in 5.0s
2026-01-15 20:13:10,038 - INFO - Thu thập được 0 posts từ thread
2026-01-15 20:13:10,040 - INFO - [16/20] Crawl thread: Qcg: Ngày không xa!...
2026-01-15 20:13:11,282 - INFO - [Thread 1943941] Existing thread, crawling reverse 1→1 until last_post_id: post-47879145
2026-01-15 20:13:12,643 - INFO - [Thread 1825273] Existing thread, crawling reverse 1630→1 until last_post_id: post-47879141
2026-01-15 20:13:13,802 - INFO - [Thread 1943941] Found last_post_id at page 1, stopping...
2026-01-15 20:13:13,803 - INFO - [Thread 1943941] Collected 0 posts in 4.9s
2026-01-15 20:13:13,804 - INFO - Thu thập được 0 posts từ thread
2026-01-15 20:13:13,807 - INFO - [17/20] Crawl thread: VIX: quân bài tẩy h nhà M...
2026-01-15 20:13:14,923 - INFO - [Thread 1825273] Found last_post_id at page 1630, stopping...
2026-01-15 20:13:14,925 - INFO - [Thread 1825273] Collected 0 posts in 4.9s
2026-01-15 20:13:14,926 - INFO - Thu thập được 0 posts từ thread
2026-01-15 20:13:14,929 - INFO - [18/20] Crawl thread: Thép-ã đến lúc...
2026-01-15 20:13:16,118 - INFO - [Thread 1903403] Existing thread, crawling reverse 559→1 until last_post_id: post-47879137
2026-01-15 20:13:17,370 - INFO - [Thread 1943755] Existing thread, crawling reverse 6→1 until last_post_id: post-47879135
2026-01-15 20:13:18,520 - INFO - [Thread 1903403] Found last_post_id at page 559, stopping...
2026-01-15 20:13:18,521 - INFO - [Thread 1903403] Collected 0 posts in 4.7s
2026-01-15 20:13:18,523 - INFO - Thu thập được 0 posts từ thread
2026-01-15 20:13:18,529 - INFO - [19/20] Crawl thread: VSC CP Cảng biển đáng chú ý !...
2026-01-15 20:13:20,043 - INFO - [Thread 1943755] Found last_post_id at page 6, stopping...
2026-01-15 20:13:20,045 - INFO - [Thread 1943755] Collected 0 posts in 5.1s
2026-01-15 20:13:20,046 - INFO - Thu thập được 0 posts từ thread
2026-01-15 20:13:20,049 - INFO - [20/20] Crawl thread: VGS - LN Q3.25 gấp 600% so cùng kỳ, kích hoạch siê...
2026-01-15 20:13:21,668 - INFO - [Thread 1917307] Existing thread, crawling reverse 47→1 until last_post_id: post-47866603
2026-01-15 20:13:22,411 - INFO - [Thread 1935865] Existing thread, crawling reverse 15→1 until last_post_id: post-47847771
2026-01-15 20:13:24,348 - INFO - [Thread 1917307] Found last_post_id at page 47, stopping...
2026-01-15 20:13:24,349 - INFO - [Thread 1917307] Collected 0 posts in 5.8s
2026-01-15 20:13:24,349 - INFO - Thu thập được 0 posts từ thread
2026-01-15 20:13:24,728 - INFO - [Thread 1935865] Found last_post_id at page 15, stopping...
2026-01-15 20:13:24,728 - INFO - [Thread 1935865] Collected 0 posts in 4.7s
2026-01-15 20:13:24,729 - INFO - Thu thập được 0 posts từ thread
2026-01-15 20:13:24,731 - INFO - Hoàn thành trang 1, tổng posts: 11
2026-01-15 20:13:28,791 - INFO - ang xử lý trang 2
2026-01-15 20:13:34,789 - INFO - Tìm thấy 20 threads trên trang 2
2026-01-15 20:13:41,166 - INFO - ã thu thập thông tin 20 threads, bắt đầu crawl posts...
2026-01-15 20:13:41,171 - INFO - [1/20] Crawl thread: Game định giá lại tài sản quốc gia -------- Cá mập...
2026-01-15 20:13:41,172 - INFO - [2/20] Crawl thread: VNM – Có đang trở lại đưng đua tăng trưởng?...
2026-01-15 20:13:43,647 - INFO - [Thread 1943639] Existing thread, crawling reverse 2→1 until last_post_id: post-47877947
2026-01-15 20:13:44,882 - INFO - [Thread 1936055] Existing thread, crawling reverse 10→1 until last_post_id: post-47876653
2026-01-15 20:13:45,964 - INFO - [Thread 1943639] Found last_post_id at page 2, stopping...
2026-01-15 20:13:45,967 - INFO - [Thread 1943639] Collected 0 posts in 4.8s
2026-01-15 20:13:45,967 - INFO - Thu thập được 0 posts từ thread
2026-01-15 20:13:45,973 - INFO - [3/20] Crawl thread: Săn tìm cổ phiếu PENNY đột biến 2025...
2026-01-15 20:13:47,261 - INFO - [Thread 1936055] Found last_post_id at page 10, stopping...
2026-01-15 20:13:47,263 - INFO - [Thread 1936055] Collected 0 posts in 6.1s
2026-01-15 20:13:47,264 - INFO - Thu thập được 0 posts từ thread
2026-01-15 20:13:47,267 - INFO - [4/20] Crawl thread: Bí mật Năng lượng năng lực Quân Sự ----☆☆☆----Top ...
2026-01-15 20:13:48,604 - INFO - [Thread 1902465] Existing thread, crawling reverse 241→1 until last_post_id: post-47872883
2026-01-15 20:13:50,007 - INFO - [Thread 1942595] Existing thread, crawling reverse 5→1 until last_post_id: post-47866933
2026-01-15 20:13:50,870 - INFO - [Thread 1902465] Found last_post_id at page 241, stopping...
2026-01-15 20:13:50,872 - INFO - [Thread 1902465] Collected 0 posts in 4.9s
2026-01-15 20:13:50,873 - INFO - Thu thập được 0 posts từ thread
2026-01-15 20:13:50,881 - INFO - [5/20] Crawl thread: Cooking BCTC, đà tăng VIC VHM đến đâu?...
2026-01-15 20:13:52,489 - INFO - [Thread 1942595] Found last_post_id at page 5, stopping...
2026-01-15 20:13:52,491 - INFO - [Thread 1942595] Collected 0 posts in 5.2s
2026-01-15 20:13:52,492 - INFO - Thu thập được 0 posts từ thread
2026-01-15 20:13:52,494 - INFO - [6/20] Crawl thread: VOS-vào sóng !...
2026-01-15 20:13:53,349 - INFO - [Thread 1943237] Existing thread, crawling reverse 6→1 until last_post_id: post-47869019
2026-01-15 20:13:54,877 - INFO - [Thread 1942127] Existing thread, crawling reverse 9→1 until last_post_id: post-47879101
2026-01-15 20:13:55,647 - INFO - [Thread 1943237] Found last_post_id at page 6, stopping...
2026-01-15 20:13:55,649 - INFO - [Thread 1943237] Collected 0 posts in 4.8s
2026-01-15 20:13:55,650 - INFO - Thu thập được 0 posts từ thread
2026-01-15 20:13:55,653 - INFO - [7/20] Crawl thread: VEA:Tổng CT Máy động lực và máy Nông nghiệp VN- CP...
2026-01-15 20:13:57,297 - INFO - [Thread 1942127] Found last_post_id at page 9, stopping...
2026-01-15 20:13:57,298 - INFO - [Thread 1942127] Collected 0 posts in 4.8s
2026-01-15 20:13:57,299 - INFO - Thu thập được 0 posts từ thread
2026-01-15 20:13:57,302 - INFO - [8/20] Crawl thread: Tim năng GVR - Tập đoàn Cao su Việt Nam...
2026-01-15 20:13:58,082 - INFO - [Thread 1835579] Existing thread, crawling reverse 376→1 until last_post_id: post-47879099
2026-01-15 20:14:00,063 - INFO - [Thread 1582019] Existing thread, crawling reverse 68→1 until last_post_id: post-47879097
2026-01-15 20:14:00,387 - INFO - [Thread 1835579] Found last_post_id at page 376, stopping...
2026-01-15 20:14:00,388 - INFO - [Thread 1835579] Collected 0 posts in 4.7s
2026-01-15 20:14:00,388 - INFO - Thu thập được 0 posts từ thread
2026-01-15 20:14:00,391 - INFO - [9/20] Crawl thread: VNI - vươn mình 1954 or 1975...
2026-01-15 20:14:02,332 - INFO - [Thread 1582019] Found last_post_id at page 68, stopping...
2026-01-15 20:14:02,335 - INFO - [Thread 1582019] Collected 0 posts in 5.0s
2026-01-15 20:14:02,337 - INFO - Thu thập được 0 posts từ thread
2026-01-15 20:14:02,341 - INFO - [10/20] Crawl thread: Bđs bắt đáy...
2026-01-15 20:14:02,749 - INFO - [Thread 1936901] Existing thread, crawling reverse 263→1 until last_post_id: post-47879089
2026-01-15 20:14:05,156 - INFO - [Thread 1936901] Found last_post_id at page 263, stopping...
2026-01-15 20:14:05,158 - INFO - [Thread 1936901] Collected 0 posts in 4.8s
2026-01-15 20:14:05,159 - INFO - Thu thập được 0 posts từ thread
2026-01-15 20:14:05,162 - INFO - [11/20] Crawl thread: VHC bước vào chu kỳ tăng trưởng...
2026-01-15 20:14:05,505 - INFO - [Thread 1940685] Existing thread, crawling reverse 51→1 until last_post_id: post-47879085
2026-01-15 20:14:07,549 - INFO - [Thread 1930571] Existing thread, crawling reverse 31→1 until last_post_id: post-47879065
2026-01-15 20:14:07,791 - INFO - [Thread 1940685] Found last_post_id at page 51, stopping...
2026-01-15 20:14:07,794 - INFO - [Thread 1940685] Collected 0 posts in 5.4s
2026-01-15 20:14:07,795 - INFO - Thu thập được 0 posts từ thread
2026-01-15 20:14:07,798 - INFO - [12/20] Crawl thread: Săn lùng cổ phiếu PENNY đột biến 2026!...
2026-01-15 20:14:09,879 - INFO - [Thread 1930571] Found last_post_id at page 31, stopping...
2026-01-15 20:14:09,880 - INFO - [Thread 1930571] Collected 0 posts in 4.7s
2026-01-15 20:14:09,880 - INFO - Thu thập được 0 posts từ thread
2026-01-15 20:14:09,883 - INFO - [13/20] Crawl thread: NVL - Những khó khăn dần được tháo gỡ...
2026-01-15 20:14:10,367 - INFO - [Thread 1943779] Existing thread, crawling reverse 7→1 until last_post_id: post-47879061
2026-01-15 20:14:12,501 - INFO - [Thread 1902473] Existing thread, crawling reverse 277→1 until last_post_id: post-47832853
2026-01-15 20:14:12,673 - INFO - [Thread 1943779] Found last_post_id at page 7, stopping...
2026-01-15 20:14:12,674 - INFO - [Thread 1943779] Collected 0 posts in 4.9s
2026-01-15 20:14:12,675 - INFO - Thu thập được 0 posts từ thread
2026-01-15 20:14:12,678 - INFO - [14/20] Crawl thread: PNJ viên kim cương sót lại mở đầu chu kỳ tăng trưở...
2026-01-15 20:14:14,865 - INFO - [Thread 1902473] Found last_post_id at page 277, stopping...
2026-01-15 20:14:14,866 - INFO - [Thread 1902473] Collected 0 posts in 5.0s
2026-01-15 20:14:14,867 - INFO - Thu thập được 0 posts từ thread
2026-01-15 20:14:14,872 - INFO - [15/20] Crawl thread: CII hưởng lợi lớn nhất đấu giá đất Thủ Thiêm...
2026-01-15 20:14:15,300 - INFO - [Thread 1940615] Existing thread, crawling reverse 20→1 until last_post_id: post-47864921
2026-01-15 20:14:17,744 - INFO - [Thread 1940615] Found last_post_id at page 20, stopping...
2026-01-15 20:14:17,744 - INFO - [Thread 1940615] Collected 0 posts in 5.1s
2026-01-15 20:14:17,744 - INFO - Thu thập được 0 posts từ thread
2026-01-15 20:14:17,746 - INFO - [16/20] Crawl thread: QCG: liệu có một trận đánh lớn?...
2026-01-15 20:14:18,030 - INFO - [Thread 1705091] Existing thread, crawling reverse 213→1 until last_post_id: post-47879041
2026-01-15 20:14:20,177 - INFO - [Thread 1943743] Existing thread, crawling reverse 2→1 until last_post_id: post-47879009
2026-01-15 20:14:20,386 - INFO - [Thread 1705091] Found last_post_id at page 213, stopping...
2026-01-15 20:14:20,389 - INFO - [Thread 1705091] Collected 0 posts in 5.5s
2026-01-15 20:14:20,389 - INFO - Thu thập được 0 posts từ thread
2026-01-15 20:14:20,395 - INFO - [17/20] Crawl thread: VGI bùng nổ lợi nhuận 2026-2030?...
2026-01-15 20:14:22,586 - INFO - [Thread 1943743] Found last_post_id at page 2, stopping...
2026-01-15 20:14:22,587 - INFO - [Thread 1943743] Collected 0 posts in 4.8s
2026-01-15 20:14:22,589 - INFO - Thu thập được 0 posts từ thread
2026-01-15 20:14:22,596 - INFO - [18/20] Crawl thread: Tản mạn v CPI và TTCK (53)...
2026-01-15 20:14:22,828 - INFO - [Thread 1936621] Existing thread, crawling reverse 27→1 until last_post_id: post-47879003
2026-01-15 20:14:25,348 - INFO - [Thread 1936621] Found last_post_id at page 27, stopping...
2026-01-15 20:14:25,350 - INFO - [Thread 1936621] Collected 0 posts in 5.0s
2026-01-15 20:14:25,351 - INFO - Thu thập được 0 posts từ thread
2026-01-15 20:14:25,355 - INFO - [19/20] Crawl thread: Ta sơn, thưởng trà….Luận phong thủy cho năm Bính ...
2026-01-15 20:14:25,376 - INFO - [Thread 1942249] Existing thread, crawling reverse 45→1 until last_post_id: post-47879001
2026-01-15 20:14:27,833 - INFO - [Thread 1942255] Existing thread, crawling reverse 146→1 until last_post_id: post-47878999
2026-01-15 20:14:27,928 - INFO - [Thread 1942249] Found last_post_id at page 45, stopping...
2026-01-15 20:14:27,929 - INFO - [Thread 1942249] Collected 0 posts in 5.3s
2026-01-15 20:14:27,930 - INFO - Thu thập được 0 posts từ thread
2026-01-15 20:14:27,933 - INFO - [20/20] Crawl thread: HQC số 1 NOXH...
2026-01-15 20:14:30,219 - INFO - [Thread 1920459] Existing thread, crawling reverse 1→1 until last_post_id: post-46952941
2026-01-15 20:14:30,433 - INFO - [Thread 1942255] Found last_post_id at page 146, stopping...
2026-01-15 20:14:30,434 - INFO - [Thread 1942255] Collected 0 posts in 5.1s
2026-01-15 20:14:30,434 - INFO - Thu thập được 0 posts từ thread
2026-01-15 20:14:33,269 - INFO - [Thread 1920459] Found last_post_id at page 1, stopping...
2026-01-15 20:14:33,269 - INFO - [Thread 1920459] Collected 0 posts in 5.3s
2026-01-15 20:14:33,270 - INFO - Thu thập được 0 posts từ thread
2026-01-15 20:14:33,271 - INFO - Hoàn thành trang 2, tổng posts: 11
2026-01-15 20:14:46,086 - INFO - ang xử lý trang 3
2026-01-15 20:14:51,790 - INFO - Tìm thấy 20 threads trên trang 3
2026-01-15 20:14:57,281 - INFO - ã thu thập thông tin 20 threads, bắt đầu crawl posts...
2026-01-15 20:14:57,285 - INFO - [1/20] Crawl thread: Vinfast - Xe điện của ngưi Việt (P3)...
2026-01-15 20:14:57,286 - INFO - [2/20] Crawl thread: CII - ầu cơ gia trị vơi tài sản tỉ $ của ...
2026-01-15 20:15:00,052 - INFO - [Thread 1882039] Existing thread, crawling reverse 800→1 until last_post_id: post-47878987
2026-01-15 20:15:00,093 - INFO - [Thread 1923365] Existing thread, crawling reverse 168→1 until last_post_id: post-47878983
2026-01-15 20:15:02,503 - INFO - [Thread 1882039] Found last_post_id at page 800, stopping...
2026-01-15 20:15:02,504 - INFO - [Thread 1882039] Collected 0 posts in 5.2s
2026-01-15 20:15:02,505 - INFO - Thu thập được 0 posts từ thread
2026-01-15 20:15:02,510 - INFO - [3/20] Crawl thread: Xin 3 chữ cái cho năm 2026......
2026-01-15 20:15:02,926 - INFO - [Thread 1923365] Found last_post_id at page 168, stopping...
2026-01-15 20:15:02,927 - INFO - [Thread 1923365] Collected 0 posts in 5.6s
2026-01-15 20:15:02,928 - INFO - Thu thập được 0 posts từ thread
2026-01-15 20:15:02,931 - INFO - [4/20] Crawl thread: STB - Cổ phiếu kịch hay đang đên hồi cao trào(...
2026-01-15 20:15:04,822 - INFO - [Thread 1943931] Existing thread, crawling reverse 1→1 until last_post_id: post-47878977
2026-01-15 20:15:05,721 - INFO - [Thread 1930607] Existing thread, crawling reverse 133→1 until last_post_id: post-47878971
2026-01-15 20:15:07,209 - INFO - [Thread 1943931] Found last_post_id at page 1, stopping...
2026-01-15 20:15:07,211 - INFO - [Thread 1943931] Collected 0 posts in 4.7s
2026-01-15 20:15:07,211 - INFO - Thu thập được 0 posts từ thread
2026-01-15 20:15:07,214 - INFO - [5/20] Crawl thread: TPHCM KCH HOẠT "TỨ TRỤ" HẠ TẦNG 293.000 TỶ – DÒNG...
2026-01-15 20:15:08,323 - INFO - [Thread 1930607] Found last_post_id at page 133, stopping...
2026-01-15 20:15:08,325 - INFO - [Thread 1930607] Collected 0 posts in 5.4s
2026-01-15 20:15:08,326 - INFO - Thu thập được 0 posts từ thread
2026-01-15 20:15:08,329 - INFO - [6/20] Crawl thread: Khuyến nghị mua VIX...
2026-01-15 20:15:09,499 - INFO - [Thread 1943939] Existing thread, crawling reverse 1→1 until last_post_id: post-47878969
2026-01-15 20:15:10,686 - INFO - [Thread 1902573] Existing thread, crawling reverse 48→1 until last_post_id: post-47878967
2026-01-15 20:15:12,635 - INFO - [Thread 1943939] Found last_post_id at page 1, stopping...
2026-01-15 20:15:12,635 - INFO - [Thread 1943939] Collected 0 posts in 5.4s
2026-01-15 20:15:12,636 - INFO - Thu thập được 0 posts từ thread
2026-01-15 20:15:12,639 - INFO - [7/20] Crawl thread: ACV- Hình trình vượt 100k/cp bắt đầu từ đây...
2026-01-15 20:15:13,393 - INFO - [Thread 1902573] Found last_post_id at page 48, stopping...
2026-01-15 20:15:13,395 - INFO - [Thread 1902573] Collected 0 posts in 5.1s
2026-01-15 20:15:13,396 - INFO - Thu thập được 0 posts từ thread
2026-01-15 20:15:13,398 - INFO - [8/20] Crawl thread: CDP: CTCP Dược phẩm Trung ương Codupha- CP đầu tư ...
2026-01-15 20:15:14,970 - INFO - [Thread 1940601] Existing thread, crawling reverse 12→1 until last_post_id: post-47878957
2026-01-15 20:15:16,166 - INFO - [Thread 1930047] Existing thread, crawling reverse 16→1 until last_post_id: post-47860857
2026-01-15 20:15:17,236 - INFO - [Thread 1940601] Found last_post_id at page 12, stopping...
2026-01-15 20:15:17,237 - INFO - [Thread 1940601] Collected 0 posts in 4.6s
2026-01-15 20:15:17,238 - INFO - Thu thập được 0 posts từ thread
2026-01-15 20:15:17,242 - INFO - [9/20] Crawl thread: HDG lợi nhuận nghìn tỷ vượt kế hoạch 2023...
2026-01-15 20:15:18,468 - INFO - [Thread 1930047] Found last_post_id at page 16, stopping...
2026-01-15 20:15:18,484 - INFO - [Thread 1930047] Collected 0 posts in 5.1s
2026-01-15 20:15:18,485 - INFO - Thu thập được 0 posts từ thread
2026-01-15 20:15:18,489 - INFO - [10/20] Crawl thread: Sau siêu phẩm BID > Tiếp đến HPG đạt điu kiện XAN...
2026-01-15 20:15:19,888 - INFO - [Thread 1857501] Existing thread, crawling reverse 504→1 until last_post_id: post-47878949
2026-01-15 20:15:20,881 - INFO - [Thread 1943825] Existing thread, crawling reverse 1→1 until last_post_id: post-47878941
2026-01-15 20:15:22,443 - INFO - [Thread 1857501] Found last_post_id at page 504, stopping...
2026-01-15 20:15:22,444 - INFO - [Thread 1857501] Collected 0 posts in 5.2s
2026-01-15 20:15:22,444 - INFO - Thu thập được 0 posts từ thread
2026-01-15 20:15:22,446 - INFO - [11/20] Crawl thread: POW tăng vốn khủng có lập đỉnh mới...
2026-01-15 20:15:23,266 - INFO - [Thread 1943825] Found last_post_id at page 1, stopping...
2026-01-15 20:15:23,268 - INFO - [Thread 1943825] Collected 0 posts in 4.8s
2026-01-15 20:15:23,269 - INFO - Thu thập được 0 posts từ thread
2026-01-15 20:15:23,273 - INFO - [12/20] Crawl thread: SSI - điểm yếu ngắn hạn của dòng chứng khoán...
2026-01-15 20:15:24,885 - INFO - [Thread 1935387] Existing thread, crawling reverse 12→1 until last_post_id: post-47878925
2026-01-15 20:15:25,637 - INFO - [Thread 1926403] Existing thread, crawling reverse 29→1 until last_post_id: post-47870185
2026-01-15 20:15:27,193 - INFO - [Thread 1935387] Found last_post_id at page 12, stopping...
2026-01-15 20:15:27,194 - INFO - [Thread 1935387] Collected 0 posts in 4.7s
2026-01-15 20:15:27,194 - INFO - Thu thập được 0 posts từ thread
2026-01-15 20:15:27,197 - INFO - [13/20] Crawl thread: VCB – Mô hình “Cốc và Tay Cầm đang hình thành?...
2026-01-15 20:15:27,987 - INFO - [Thread 1926403] Found last_post_id at page 29, stopping...
2026-01-15 20:15:27,988 - INFO - [Thread 1926403] Collected 0 posts in 4.7s
2026-01-15 20:15:27,988 - INFO - Thu thập được 0 posts từ thread
2026-01-15 20:15:27,991 - INFO - [14/20] Crawl thread: Tập hợp cổ đông HVG- Công Ty Thuỷ Sản Hùng Vương...
2026-01-15 20:15:29,588 - INFO - [Thread 1933181] Existing thread, crawling reverse 2→1 until last_post_id: post-47878921
2026-01-15 20:15:30,291 - INFO - [Thread 1887673] Existing thread, crawling reverse 3→1 until last_post_id: post-46255775
2026-01-15 20:15:32,308 - INFO - [Thread 1933181] Found last_post_id at page 2, stopping...
2026-01-15 20:15:32,310 - INFO - [Thread 1933181] Collected 0 posts in 5.1s
2026-01-15 20:15:32,310 - INFO - Thu thập được 0 posts từ thread
2026-01-15 20:15:32,313 - INFO - [15/20] Crawl thread: PHR - Sắp nhận đn bù 2-3k tỷ từ Thaco...
2026-01-15 20:15:32,825 - INFO - [Thread 1887673] Found last_post_id at page 3, stopping...
2026-01-15 20:15:32,827 - INFO - [Thread 1887673] Collected 0 posts in 4.8s
2026-01-15 20:15:32,829 - INFO - Thu thập được 0 posts từ thread
2026-01-15 20:15:32,832 - INFO - [16/20] Crawl thread: Tất cả các dòng sông đu chảy - P2...
2026-01-15 20:15:34,866 - INFO - [Thread 1918203] Existing thread, crawling reverse 240→1 until last_post_id: post-47878881
2026-01-15 20:15:35,196 - INFO - [Thread 1934311] Existing thread, crawling reverse 102→1 until last_post_id: post-47878879
2026-01-15 20:15:37,212 - INFO - [Thread 1918203] Found last_post_id at page 240, stopping...
2026-01-15 20:15:37,213 - INFO - [Thread 1918203] Collected 0 posts in 4.9s
2026-01-15 20:15:37,214 - INFO - Thu thập được 0 posts từ thread
2026-01-15 20:15:37,221 - INFO - [17/20] Crawl thread: DVN lên được bao nhiêu mi ngưi...
2026-01-15 20:15:37,783 - INFO - [Thread 1934311] Found last_post_id at page 102, stopping...
2026-01-15 20:15:37,783 - INFO - [Thread 1934311] Collected 0 posts in 4.9s
2026-01-15 20:15:37,783 - INFO - Thu thập được 0 posts từ thread
2026-01-15 20:15:37,786 - INFO - [18/20] Crawl thread: HPG- Sự trở lại của nhà Vua...
2026-01-15 20:15:39,592 - INFO - [Thread 1943935] Existing thread, crawling reverse 1→1 until last_post_id: post-47878841
2026-01-15 20:15:40,164 - INFO - [Thread 1925045] Existing thread, crawling reverse 266→1 until last_post_id: post-47878835
2026-01-15 20:15:41,855 - INFO - [Thread 1943935] Found last_post_id at page 1, stopping...
2026-01-15 20:15:41,857 - INFO - [Thread 1943935] Collected 0 posts in 4.6s
2026-01-15 20:15:41,858 - INFO - Thu thập được 0 posts từ thread
2026-01-15 20:15:41,861 - INFO - [19/20] Crawl thread: SZL-có xứng đáng để đầu tư?...
2026-01-15 20:15:42,446 - INFO - [Thread 1925045] Found last_post_id at page 266, stopping...
2026-01-15 20:15:42,447 - INFO - [Thread 1925045] Collected 0 posts in 4.7s
2026-01-15 20:15:42,448 - INFO - Thu thập được 0 posts từ thread
2026-01-15 20:15:42,452 - INFO - [20/20] Crawl thread: 14.1 không nên phức tạp quá - múc là có ăn...
2026-01-15 20:15:45,100 - INFO - [Thread 1293301] Existing thread, crawling reverse 752→1 until last_post_id: post-47878833
2026-01-15 20:15:45,810 - INFO - [Thread 1943725] Existing thread, crawling reverse 6→1 until last_post_id: post-47878829
2026-01-15 20:15:47,387 - INFO - [Thread 1293301] Found last_post_id at page 752, stopping...
2026-01-15 20:15:47,387 - INFO - [Thread 1293301] Collected 0 posts in 5.5s
2026-01-15 20:15:47,388 - INFO - Thu thập được 0 posts từ thread
2026-01-15 20:15:48,149 - INFO - [Thread 1943725] Found last_post_id at page 6, stopping...
2026-01-15 20:15:48,151 - INFO - [Thread 1943725] Collected 0 posts in 5.7s
2026-01-15 20:15:48,153 - INFO - Thu thập được 0 posts từ thread
2026-01-15 20:15:48,155 - INFO - Hoàn thành trang 3, tổng posts: 11
2026-01-15 20:15:59,732 - INFO - ang xử lý trang 4
2026-01-15 20:16:05,283 - INFO - Tìm thấy 20 threads trên trang 4
2026-01-15 20:16:11,247 - INFO - ã thu thập thông tin 20 threads, bắt đầu crawl posts...
2026-01-15 20:16:11,252 - INFO - [1/20] Crawl thread: Game mới SHB. Múc mạnh để mua nhà mua xe...
2026-01-15 20:16:11,252 - INFO - [2/20] Crawl thread: TTN - DN viễn thông vốn hoá 200 tỷ và hợp đồng gần...
2026-01-15 20:16:13,586 - INFO - [Thread 1900397] Existing thread, crawling reverse 536→1 until last_post_id: post-47878817
2026-01-15 20:16:13,855 - INFO - [Thread 1303829] Existing thread, crawling reverse 72→1 until last_post_id: post-47878815
2026-01-15 20:16:15,913 - INFO - [Thread 1900397] Found last_post_id at page 536, stopping...
2026-01-15 20:16:15,913 - INFO - [Thread 1900397] Collected 0 posts in 4.7s
2026-01-15 20:16:15,914 - INFO - Thu thập được 0 posts từ thread
2026-01-15 20:16:15,917 - INFO - [3/20] Crawl thread: CTI có gì?...
2026-01-15 20:16:16,526 - INFO - [Thread 1303829] Found last_post_id at page 72, stopping...
2026-01-15 20:16:16,527 - INFO - [Thread 1303829] Collected 0 posts in 5.3s
2026-01-15 20:16:16,528 - INFO - Thu thập được 0 posts từ thread
2026-01-15 20:16:16,532 - INFO - [4/20] Crawl thread: Công ty vốn hoá 900 tỷ tin mặt 3000 tỷ...
2026-01-15 20:16:18,334 - INFO - [Thread 1911395] Existing thread, crawling reverse 39→1 until last_post_id: post-47878813
2026-01-15 20:16:19,195 - INFO - [Thread 1902081] Existing thread, crawling reverse 20→1 until last_post_id: post-47878809
2026-01-15 20:16:20,867 - INFO - [Thread 1911395] Found last_post_id at page 39, stopping...
2026-01-15 20:16:20,870 - INFO - [Thread 1911395] Collected 0 posts in 5.0s
2026-01-15 20:16:20,871 - INFO - Thu thập được 0 posts từ thread
2026-01-15 20:16:20,874 - INFO - [5/20] Crawl thread: Topic cổ đông dài hạn Nhiệt điện Quảng Ninh - ầu ...
2026-01-15 20:16:21,609 - INFO - [Thread 1902081] Found last_post_id at page 20, stopping...
2026-01-15 20:16:21,611 - INFO - [Thread 1902081] Collected 0 posts in 5.1s
2026-01-15 20:16:21,612 - INFO - Thu thập được 0 posts từ thread
2026-01-15 20:16:21,615 - INFO - [6/20] Crawl thread: FOC - Viên kim cương bị lãng quên - Trỗi dậy cùng ...
2026-01-15 20:16:23,300 - INFO - [Thread 1943359] Existing thread, crawling reverse 2→1 until last_post_id: post-47878803
2026-01-15 20:16:24,290 - INFO - [Thread 1912015] Existing thread, crawling reverse 13→1 until last_post_id: post-47878789
2026-01-15 20:16:25,631 - INFO - [Thread 1943359] Found last_post_id at page 2, stopping...
2026-01-15 20:16:25,632 - INFO - [Thread 1943359] Collected 0 posts in 4.8s
2026-01-15 20:16:25,634 - INFO - Thu thập được 0 posts từ thread
2026-01-15 20:16:25,639 - INFO - [7/20] Crawl thread: Sóng Uptrend tốt nhất chu kỳ dự kiến 2026 +3-6 thá...
2026-01-15 20:16:26,790 - INFO - [Thread 1912015] Found last_post_id at page 13, stopping...
2026-01-15 20:16:26,798 - INFO - [Thread 1912015] Collected 0 posts in 5.2s
2026-01-15 20:16:26,798 - INFO - Thu thập được 0 posts từ thread
2026-01-15 20:16:26,802 - INFO - [8/20] Crawl thread: Làm gì có sóng cổ phiếu ngân hàng lúc này…...
2026-01-15 20:16:28,821 - INFO - [Thread 1942299] Existing thread, crawling reverse 23→1 until last_post_id: post-47878781
2026-01-15 20:16:29,523 - INFO - [Thread 1943823] Existing thread, crawling reverse 7→1 until last_post_id: post-47878749
2026-01-15 20:16:31,179 - INFO - [Thread 1942299] Found last_post_id at page 23, stopping...
2026-01-15 20:16:31,179 - INFO - [Thread 1942299] Collected 0 posts in 5.5s
2026-01-15 20:16:31,180 - INFO - Thu thập được 0 posts từ thread
2026-01-15 20:16:31,184 - INFO - [9/20] Crawl thread: Các cổ phiếu nhà nước cầm trên 80% mà giá chưa tăn...
2026-01-15 20:16:31,866 - INFO - [Thread 1943823] Found last_post_id at page 7, stopping...
2026-01-15 20:16:31,868 - INFO - [Thread 1943823] Collected 0 posts in 5.1s
2026-01-15 20:16:31,869 - INFO - Thu thập được 0 posts từ thread
2026-01-15 20:16:31,875 - INFO - [10/20] Crawl thread: 2026: Dự ỉnh 1960- áy 1340. Cơ hội nào cho NT...
2026-01-15 20:16:33,571 - INFO - [Thread 1943905] Existing thread, crawling reverse 2→1 until last_post_id: post-47877865
2026-01-15 20:16:34,678 - INFO - [Thread 1942323] Existing thread, crawling reverse 31→1 until last_post_id: post-47878221
2026-01-15 20:16:35,926 - INFO - [Thread 1943905] Found last_post_id at page 2, stopping...
2026-01-15 20:16:35,927 - INFO - [Thread 1943905] Collected 0 posts in 4.7s
2026-01-15 20:16:35,927 - INFO - Thu thập được 0 posts từ thread
2026-01-15 20:16:35,930 - INFO - [11/20] Crawl thread: 15/1 bắt đáy...
2026-01-15 20:16:37,154 - INFO - [Thread 1942323] Found last_post_id at page 31, stopping...
2026-01-15 20:16:37,155 - INFO - [Thread 1942323] Collected 0 posts in 5.3s
2026-01-15 20:16:37,156 - INFO - Thu thập được 0 posts từ thread
2026-01-15 20:16:37,160 - INFO - [12/20] Crawl thread: VCI target 41.5, 44.5, 47.5...hết sóng 52 - 58...
2026-01-15 20:16:38,273 - INFO - [Thread 1943867] Existing thread, crawling reverse 3→1 until last_post_id: post-47878601
2026-01-15 20:16:39,624 - INFO - [Thread 1943853] Existing thread, crawling reverse 3→1 until last_post_id: post-47878595
2026-01-15 20:16:40,516 - INFO - [Thread 1943867] Found last_post_id at page 3, stopping...
2026-01-15 20:16:40,519 - INFO - [Thread 1943867] Collected 0 posts in 4.6s
2026-01-15 20:16:40,520 - INFO - Thu thập được 0 posts từ thread
2026-01-15 20:16:40,524 - INFO - [13/20] Crawl thread: Gía mục tiêu cp ……..siêu sóng ….siêu sóng……….....
2026-01-15 20:16:41,846 - INFO - [Thread 1943853] Found last_post_id at page 3, stopping...
2026-01-15 20:16:41,848 - INFO - [Thread 1943853] Collected 0 posts in 4.7s
2026-01-15 20:16:41,849 - INFO - Thu thập được 0 posts từ thread
2026-01-15 20:16:41,852 - INFO - [14/20] Crawl thread: BID: Tăng một mạch 7 phiên 40%...
2026-01-15 20:16:42,886 - INFO - [Thread 1943745] Existing thread, crawling reverse 2→1 until last_post_id: post-47878583
2026-01-15 20:16:44,176 - INFO - [Thread 1943741] Existing thread, crawling reverse 1→1 until last_post_id: post-47878569
2026-01-15 20:16:45,255 - INFO - [Thread 1943745] Found last_post_id at page 2, stopping...
2026-01-15 20:16:45,256 - INFO - [Thread 1943745] Collected 0 posts in 4.7s
2026-01-15 20:16:45,257 - INFO - Thu thập được 0 posts từ thread
2026-01-15 20:16:45,259 - INFO - [15/20] Crawl thread: Lạm bàn v Cảng à Nẵng - CDN...
2026-01-15 20:16:46,571 - INFO - [Thread 1943741] Found last_post_id at page 1, stopping...
2026-01-15 20:16:46,572 - INFO - [Thread 1943741] Collected 0 posts in 4.7s
2026-01-15 20:16:46,574 - INFO - Thu thập được 0 posts từ thread
2026-01-15 20:16:46,583 - INFO - [16/20] Crawl thread: THG-Những nốt thăng trầm...
2026-01-15 20:16:47,794 - INFO - [Thread 1883213] Existing thread, crawling reverse 28→1 until last_post_id: post-47878553
2026-01-15 20:16:49,492 - INFO - [Thread 1924015] Existing thread, crawling reverse 94→1 until last_post_id: post-47878551
2026-01-15 20:16:50,384 - INFO - [Thread 1883213] Found last_post_id at page 28, stopping...
2026-01-15 20:16:50,384 - INFO - [Thread 1883213] Collected 0 posts in 5.1s
2026-01-15 20:16:50,385 - INFO - Thu thập được 0 posts từ thread
2026-01-15 20:16:50,388 - INFO - [17/20] Crawl thread: DCM - Liên tục phá đỉnh 2025-2026...
2026-01-15 20:16:51,788 - INFO - [Thread 1924015] Found last_post_id at page 94, stopping...
2026-01-15 20:16:51,790 - INFO - [Thread 1924015] Collected 0 posts in 5.2s
2026-01-15 20:16:51,791 - INFO - Thu thập được 0 posts từ thread
2026-01-15 20:16:51,793 - INFO - [18/20] Crawl thread: VNM Cơ hội đang rất rõ ràng !...
2026-01-15 20:16:52,743 - INFO - [Thread 1929137] Existing thread, crawling reverse 53→1 until last_post_id: post-47878547
2026-01-15 20:16:54,082 - INFO - [Thread 1926367] Existing thread, crawling reverse 175→1 until last_post_id: post-47878521
2026-01-15 20:16:55,046 - INFO - [Thread 1929137] Found last_post_id at page 53, stopping...
2026-01-15 20:16:55,046 - INFO - [Thread 1929137] Collected 0 posts in 4.7s
2026-01-15 20:16:55,047 - INFO - Thu thập được 0 posts từ thread
2026-01-15 20:16:55,049 - INFO - [19/20] Crawl thread: Index Ký Sự - P3...
2026-01-15 20:16:57,972 - INFO - [Thread 1942309] Existing thread, crawling reverse 7→1 until last_post_id: post-47878535
2026-01-15 20:16:58,053 - INFO - [Thread 1926367] Found last_post_id at page 175, stopping...
2026-01-15 20:16:58,054 - INFO - [Thread 1926367] Collected 0 posts in 6.3s
2026-01-15 20:16:58,055 - INFO - Thu thập được 0 posts từ thread
2026-01-15 20:16:58,058 - INFO - [20/20] Crawl thread: List thoái vốn SCIC update...
2026-01-15 20:17:00,559 - INFO - [Thread 1943921] Existing thread, crawling reverse 1→1 until last_post_id: post-47877983
2026-01-15 20:17:02,486 - INFO - [Thread 1942309] Found last_post_id at page 7, stopping...
2026-01-15 20:17:02,487 - INFO - [Thread 1942309] Collected 0 posts in 7.4s
2026-01-15 20:17:02,487 - INFO - Thu thập được 0 posts từ thread
2026-01-15 20:17:02,832 - INFO - [Thread 1943921] Found last_post_id at page 1, stopping...
2026-01-15 20:17:02,833 - INFO - [Thread 1943921] Collected 0 posts in 4.8s
2026-01-15 20:17:02,833 - INFO - Thu thập được 0 posts từ thread
2026-01-15 20:17:02,835 - INFO - Hoàn thành trang 4, tổng posts: 11
2026-01-15 20:17:13,841 - INFO - ang xử lý trang 5
2026-01-15 20:17:18,988 - INFO - Tìm thấy 20 threads trên trang 5
2026-01-15 20:17:23,795 - INFO - ã thu thập thông tin 20 threads, bắt đầu crawl posts...
2026-01-15 20:17:23,800 - INFO - [1/20] Crawl thread: Nghành Dầu khí sẽ dẫn sóng cho năm 2026?...
2026-01-15 20:17:23,800 - INFO - [2/20] Crawl thread: DGC con hào kinh tế...
2026-01-15 20:17:26,486 - INFO - [Thread 1942541] Existing thread, crawling reverse 5→1 until last_post_id: post-47878507
2026-01-15 20:17:26,766 - INFO - [Thread 1943403] Existing thread, crawling reverse 5→1 until last_post_id: post-47878459
2026-01-15 20:17:28,737 - INFO - [Thread 1942541] Found last_post_id at page 5, stopping...
2026-01-15 20:17:28,737 - INFO - [Thread 1942541] Collected 0 posts in 4.9s
2026-01-15 20:17:28,738 - INFO - Thu thập được 0 posts từ thread
2026-01-15 20:17:28,742 - INFO - [3/20] Crawl thread: Căng đét...
2026-01-15 20:17:29,039 - INFO - [Thread 1943403] Found last_post_id at page 5, stopping...
2026-01-15 20:17:29,039 - INFO - [Thread 1943403] Collected 0 posts in 5.2s
2026-01-15 20:17:29,039 - INFO - Thu thập được 0 posts từ thread
2026-01-15 20:17:29,041 - INFO - [4/20] Crawl thread: Cuối năm 2025, thoát xu hướng tích luỹ...
2026-01-15 20:17:31,239 - INFO - [Thread 1943929] Existing thread, crawling reverse 1→1 until last_post_id: post-47878457
2026-01-15 20:17:31,461 - INFO - [Thread 1936049] Existing thread, crawling reverse 8→1 until last_post_id: post-47878445
2026-01-15 20:17:33,789 - INFO - [Thread 1936049] Found last_post_id at page 8, stopping...
2026-01-15 20:17:33,790 - INFO - [Thread 1936049] Collected 0 posts in 4.7s
2026-01-15 20:17:33,790 - INFO - Thu thập được 0 posts từ thread
2026-01-15 20:17:33,795 - INFO - [5/20] Crawl thread: EVF Doanh nghiệp tăng trưởng...
2026-01-15 20:17:34,116 - INFO - [Thread 1943929] Found last_post_id at page 1, stopping...
2026-01-15 20:17:34,116 - INFO - [Thread 1943929] Collected 0 posts in 5.4s
2026-01-15 20:17:34,117 - INFO - Thu thập được 0 posts từ thread
2026-01-15 20:17:34,120 - INFO - [6/20] Crawl thread: Tam tấu SSI - VIX - CTS ! Siêu game bom tấn!...
2026-01-15 20:17:36,465 - INFO - [Thread 1923417] Existing thread, crawling reverse 296→1 until last_post_id: post-47878409
2026-01-15 20:17:36,864 - INFO - [Thread 1935667] Existing thread, crawling reverse 4→1 until last_post_id: post-47878423
2026-01-15 20:17:38,860 - INFO - [Thread 1923417] Found last_post_id at page 296, stopping...
2026-01-15 20:17:38,860 - INFO - [Thread 1923417] Collected 0 posts in 4.7s
2026-01-15 20:17:38,860 - INFO - Thu thập được 0 posts từ thread
2026-01-15 20:17:38,862 - INFO - [7/20] Crawl thread: Dòng tin lan toả bước sang năm 2026...
2026-01-15 20:17:39,232 - INFO - [Thread 1935667] Found last_post_id at page 4, stopping...
2026-01-15 20:17:39,233 - INFO - [Thread 1935667] Collected 0 posts in 5.4s
2026-01-15 20:17:39,233 - INFO - Thu thập được 0 posts từ thread
2026-01-15 20:17:39,235 - INFO - [8/20] Crawl thread: HAG - sắp sang trang mới cổ phiếu vươn mình tăng t...
2026-01-15 20:17:41,629 - INFO - [Thread 1942743] Existing thread, crawling reverse 6→1 until last_post_id: post-47878399
2026-01-15 20:17:41,640 - INFO - [Thread 1935815] Existing thread, crawling reverse 105→1 until last_post_id: post-47878379
2026-01-15 20:17:43,917 - INFO - [Thread 1942743] Found last_post_id at page 6, stopping...
2026-01-15 20:17:43,917 - INFO - [Thread 1942743] Collected 0 posts in 5.1s
2026-01-15 20:17:43,918 - INFO - Thu thập được 0 posts từ thread
2026-01-15 20:17:43,920 - INFO - [9/20] Crawl thread: PGV - Khủng long ngành điện...
2026-01-15 20:17:44,487 - INFO - [Thread 1935815] Found last_post_id at page 105, stopping...
2026-01-15 20:17:44,487 - INFO - [Thread 1935815] Collected 0 posts in 5.3s
2026-01-15 20:17:44,488 - INFO - Thu thập được 0 posts từ thread
2026-01-15 20:17:44,491 - INFO - [10/20] Crawl thread: NT2 - Góc nhìn v giá trị!!!...
2026-01-15 20:17:46,452 - INFO - [Thread 1550217] Existing thread, crawling reverse 253→1 until last_post_id: post-47878345
2026-01-15 20:17:46,783 - INFO - [Thread 1935045] Existing thread, crawling reverse 6→1 until last_post_id: post-47878307
2026-01-15 20:17:48,839 - INFO - [Thread 1550217] Found last_post_id at page 253, stopping...
2026-01-15 20:17:48,840 - INFO - [Thread 1550217] Collected 0 posts in 4.9s
2026-01-15 20:17:48,840 - INFO - Thu thập được 0 posts từ thread
2026-01-15 20:17:48,843 - INFO - [11/20] Crawl thread: HNG Hướng tới vùng 20...
2026-01-15 20:17:49,118 - INFO - [Thread 1935045] Found last_post_id at page 6, stopping...
2026-01-15 20:17:49,119 - INFO - [Thread 1935045] Collected 0 posts in 4.6s
2026-01-15 20:17:49,119 - INFO - Thu thập được 0 posts từ thread
2026-01-15 20:17:49,121 - INFO - [12/20] Crawl thread: ISH vs GHC – Cổ tức bằng tin ổn định và trn đi!...
2026-01-15 20:17:51,169 - INFO - [Thread 1910241] Existing thread, crawling reverse 149→1 until last_post_id: post-47878235
2026-01-15 20:17:51,595 - INFO - [Thread 1844081] Existing thread, crawling reverse 44→1 until last_post_id: post-47878229
2026-01-15 20:17:53,430 - INFO - [Thread 1910241] Found last_post_id at page 149, stopping...
2026-01-15 20:17:53,431 - INFO - [Thread 1910241] Collected 0 posts in 4.6s
2026-01-15 20:17:53,431 - INFO - Thu thập được 0 posts từ thread
2026-01-15 20:17:53,433 - INFO - [13/20] Crawl thread: VNM đạt lợi nhuận hơn +19%, gặp gỡ trực tiếp chuyê...
2026-01-15 20:17:53,836 - INFO - [Thread 1844081] Found last_post_id at page 44, stopping...
2026-01-15 20:17:53,837 - INFO - [Thread 1844081] Collected 0 posts in 4.7s
2026-01-15 20:17:53,837 - INFO - Thu thập được 0 posts từ thread
2026-01-15 20:17:53,839 - INFO - [14/20] Crawl thread: Nhận định thị trưng hàng ngày...
2026-01-15 20:17:56,006 - INFO - [Thread 1943891] Existing thread, crawling reverse 1→1 until last_post_id: post-47877171
2026-01-15 20:17:56,184 - INFO - [Thread 1806081] Existing thread, crawling reverse 122→1 until last_post_id: post-47878143
2026-01-15 20:17:58,267 - INFO - [Thread 1943891] Found last_post_id at page 1, stopping...
2026-01-15 20:17:58,267 - INFO - [Thread 1943891] Collected 0 posts in 4.8s
2026-01-15 20:17:58,267 - INFO - Thu thập được 0 posts từ thread
2026-01-15 20:17:58,270 - INFO - [15/20] Crawl thread: Vĩ mô ngành BS – Cơn bão lớn hay chỉ là khó khăn ...
2026-01-15 20:17:59,160 - INFO - [Thread 1806081] Found last_post_id at page 122, stopping...
2026-01-15 20:17:59,161 - INFO - [Thread 1806081] Collected 0 posts in 5.3s
2026-01-15 20:17:59,162 - INFO - Thu thập được 0 posts từ thread
2026-01-15 20:17:59,165 - INFO - [16/20] Crawl thread: Bất động sản...đến gi bắt đáy...
2026-01-15 20:18:01,009 - INFO - [Thread 1940867] Existing thread, crawling reverse 2→1 until last_post_id: post-47878133
2026-01-15 20:18:01,500 - INFO - [Thread 1943193] Existing thread, crawling reverse 5→1 until last_post_id: post-47877167
2026-01-15 20:18:03,285 - INFO - [Thread 1940867] Found last_post_id at page 2, stopping...
2026-01-15 20:18:03,285 - INFO - [Thread 1940867] Collected 0 posts in 5.0s
2026-01-15 20:18:03,286 - INFO - Thu thập được 0 posts từ thread
2026-01-15 20:18:03,288 - INFO - [17/20] Crawl thread: PVC - ơn vị số 1 trong mảng bảo dưỡng !...
2026-01-15 20:18:03,916 - INFO - [Thread 1943193] Found last_post_id at page 5, stopping...
2026-01-15 20:18:03,916 - INFO - [Thread 1943193] Collected 0 posts in 4.8s
2026-01-15 20:18:03,917 - INFO - Thu thập được 0 posts từ thread
2026-01-15 20:18:03,919 - INFO - [18/20] Crawl thread: PVC – Kỳ vng trở thành đơn vị số 1 trong mảng bảo...
2026-01-15 20:18:05,636 - INFO - [Thread 1880851] Existing thread, crawling reverse 13→1 until last_post_id: post-47878105
2026-01-15 20:18:06,333 - INFO - [Thread 1943841] Existing thread, crawling reverse 1→1 until last_post_id: post-47878087
2026-01-15 20:18:08,003 - INFO - [Thread 1880851] Found last_post_id at page 13, stopping...
2026-01-15 20:18:08,003 - INFO - [Thread 1880851] Collected 0 posts in 4.7s
2026-01-15 20:18:08,004 - INFO - Thu thập được 0 posts từ thread
2026-01-15 20:18:08,006 - INFO - [19/20] Crawl thread: Cổ phiếu VEA: Triển vng đầu tư như thế nào trong ...
2026-01-15 20:18:09,132 - INFO - [Thread 1943841] Found last_post_id at page 1, stopping...
2026-01-15 20:18:09,132 - INFO - [Thread 1943841] Collected 0 posts in 5.2s
2026-01-15 20:18:09,133 - INFO - Thu thập được 0 posts từ thread
2026-01-15 20:18:09,137 - INFO - [20/20] Crawl thread: CSM - Bạn đưng tin cậy...
2026-01-15 20:18:10,350 - INFO - [Thread 1902277] Existing thread, crawling reverse 1→1 until last_post_id: post-47878067
2026-01-15 20:18:11,879 - INFO - [Thread 1928135] Existing thread, crawling reverse 81→1 until last_post_id: post-47878017
2026-01-15 20:18:12,603 - INFO - [Thread 1902277] Found last_post_id at page 1, stopping...
2026-01-15 20:18:12,604 - INFO - [Thread 1902277] Collected 0 posts in 4.6s
2026-01-15 20:18:12,604 - INFO - Thu thập được 0 posts từ thread
2026-01-15 20:18:14,175 - INFO - [Thread 1928135] Found last_post_id at page 81, stopping...
2026-01-15 20:18:14,176 - INFO - [Thread 1928135] Collected 0 posts in 5.0s
2026-01-15 20:18:14,176 - INFO - Thu thập được 0 posts từ thread
2026-01-15 20:18:14,179 - INFO - Hoàn thành trang 5, tổng posts: 11
2026-01-15 20:18:25,026 - INFO - ang xử lý trang 6
2026-01-15 20:18:35,108 - WARNING - Không tìm thấy nút next tại trang 6
2026-01-15 20:18:37,621 - INFO - Selenium driver stopped
2026-01-15 20:18:37,622 - INFO - Hoàn tất! Tổng cộng thu thập: 11 posts
2026-01-15 20:18:37,623 - INFO - ✅ Hybrid Crawler completed: 11 posts in 385.7s
2026-01-15 20:18:37,624 - INFO - 📊 Summary: 100 threads (0 new)
2026-01-15 20:18:37,631 - INFO - 🔄 Scheduler is running. Press Ctrl+C to stop.
2026-01-15 20:18:50,010 - INFO - Received signal 2, shutting down...
2026-01-15 20:18:50,011 - INFO - Scheduler has been shut down
2026-01-15 20:18:50,012 - INFO - 🛑 Scheduler stopped
