2026-01-15 18:25:58,459 - INFO - Log file created: logs/scheduler_2026-01-15_18-25-58.log
2026-01-15 18:25:58,495 - INFO - Connected to PostgreSQL: f319_data
2026-01-15 18:25:58,520 - INFO - Adding job tentatively -- it will be properly scheduled when the scheduler starts
2026-01-15 18:25:58,521 - INFO -  Hybrid Crawler scheduled every 4 hours
2026-01-15 18:25:58,521 - INFO - Added job "Hybrid Crawler Interval Job" to job store "default"
2026-01-15 18:25:58,521 - INFO - Scheduler started
2026-01-15 18:25:58,522 - INFO -  Scheduler started successfully
2026-01-15 18:25:58,527 - INFO - 📋 Hybrid Crawler Interval Job: next run at 2026-01-15 22:25:58.520821+07:00
2026-01-15 18:25:58,527 - INFO - 🚀 Running initial hybrid crawler...
2026-01-15 18:25:58,527 - INFO - 🚀 Starting Hybrid Crawler job...
2026-01-15 18:25:58,528 - INFO - ====== WebDriver manager ======
2026-01-15 18:25:59,472 - INFO - Get LATEST chromedriver version for google-chrome
2026-01-15 18:25:59,986 - INFO - Get LATEST chromedriver version for google-chrome
2026-01-15 18:26:00,385 - INFO - Driver [C:\Users\admin\.wdm\drivers\chromedriver\win64\143.0.7499.192\chromedriver-win32/chromedriver.exe] found in cache
2026-01-15 18:26:01,509 - INFO - Selenium driver started
2026-01-15 18:26:01,509 - INFO - ang load trang (New posts)...
2026-01-15 18:26:06,251 - INFO - ✓ URL có pagination: https://f319.com/find-new/posts
2026-01-15 18:26:06,251 - INFO - Sử dụng URL: https://f319.com/find-new/posts
2026-01-15 18:26:06,251 - INFO - ang xử lý trang 1
2026-01-15 18:26:08,274 - INFO - Tìm thấy 20 threads trên trang 1
2026-01-15 18:26:11,671 - INFO - ã thu thập thông tin 20 threads, bắt đầu crawl posts...
2026-01-15 18:26:11,675 - INFO - [1/20] Crawl thread: Tản mạn v CPI và TTCK (53)...
2026-01-15 18:26:11,676 - INFO - [2/20] Crawl thread: ánh giá thị trưng!...
2026-01-15 18:26:14,318 - INFO - [Thread 1942249] Existing thread, crawling reverse 45→1 until last_post_id: post-47878649
2026-01-15 18:26:14,431 - INFO - [Thread 1941133] Existing thread, crawling reverse 25→1 until last_post_id: post-47878861
2026-01-15 18:26:16,597 - INFO - [Thread 1942249] Found last_post_id at page 45, stopping...
2026-01-15 18:26:16,610 - INFO - [Thread 1942249] Final batch inserted 2/2 posts
2026-01-15 18:26:16,612 - INFO - [Thread 1942249] Collected 2 posts in 4.9s
2026-01-15 18:26:16,612 - INFO - Thu thập được 2 posts từ thread
2026-01-15 18:26:16,614 - INFO - [3/20] Crawl thread: SSI - điểm yếu ngắn hạn của dòng chứng khoán...
2026-01-15 18:26:16,733 - INFO - [Thread 1941133] Found last_post_id at page 25, stopping...
2026-01-15 18:26:16,738 - INFO - [Thread 1941133] Final batch inserted 1/1 posts
2026-01-15 18:26:16,741 - INFO - [Thread 1941133] Collected 1 posts in 5.1s
2026-01-15 18:26:16,741 - INFO - Thu thập được 1 posts từ thread
2026-01-15 18:26:16,744 - INFO - [4/20] Crawl thread: 6LON_banks(3/4 Big.Banks)Bơm máo,dùng hết ko Ae?...
2026-01-15 18:26:18,924 - INFO - [Thread 1926403] Existing thread, crawling reverse 29→1 until last_post_id: post-47870185
2026-01-15 18:26:19,064 - INFO - [Thread 1943267] Existing thread, crawling reverse 40→1 until last_post_id: post-47878857
2026-01-15 18:26:21,219 - INFO - [Thread 1926403] Found last_post_id at page 29, stopping...
2026-01-15 18:26:21,219 - INFO - [Thread 1926403] Collected 0 posts in 4.6s
2026-01-15 18:26:21,220 - INFO - Thu thập được 0 posts từ thread
2026-01-15 18:26:21,222 - INFO - [5/20] Crawl thread: Sau siêu phẩm BID > Tiếp đến HPG đạt điu kiện XAN...
2026-01-15 18:26:21,374 - INFO - [Thread 1943267] Found last_post_id at page 40, stopping...
2026-01-15 18:26:21,379 - INFO - [Thread 1943267] Final batch inserted 3/3 posts
2026-01-15 18:26:21,381 - INFO - [Thread 1943267] Collected 3 posts in 4.6s
2026-01-15 18:26:21,382 - INFO - Thu thập được 3 posts từ thread
2026-01-15 18:26:21,384 - INFO - [6/20] Crawl thread: VCB – Mô hình “Cốc và Tay Cầm đang hình thành?...
2026-01-15 18:26:23,473 - INFO - [Thread 1943825] Existing thread, crawling reverse 1→1 until last_post_id: post-47875205
2026-01-15 18:26:23,673 - INFO - [Thread 1933181] Existing thread, crawling reverse 2→1 until last_post_id: post-47878675
2026-01-15 18:26:25,784 - INFO - [Thread 1943825] Found last_post_id at page 1, stopping...
2026-01-15 18:26:25,790 - INFO - [Thread 1943825] Final batch inserted 1/1 posts
2026-01-15 18:26:25,791 - INFO - [Thread 1943825] Collected 1 posts in 4.6s
2026-01-15 18:26:25,793 - INFO - Thu thập được 1 posts từ thread
2026-01-15 18:26:25,794 - INFO - [7/20] Crawl thread: Ta sơn, thưởng trà….Luận phong thủy cho năm Bính ...
2026-01-15 18:26:25,971 - INFO - [Thread 1933181] Found last_post_id at page 2, stopping...
2026-01-15 18:26:25,975 - INFO - [Thread 1933181] Final batch inserted 1/1 posts
2026-01-15 18:26:25,977 - INFO - [Thread 1933181] Collected 1 posts in 4.6s
2026-01-15 18:26:25,977 - INFO - Thu thập được 1 posts từ thread
2026-01-15 18:26:25,981 - INFO - [8/20] Crawl thread: Tập hợp cổ đông HVG- Công Ty Thuỷ Sản Hùng Vương...
2026-01-15 18:26:28,110 - INFO - [Thread 1942255] Existing thread, crawling reverse 146→1 until last_post_id: post-47878869
2026-01-15 18:26:28,273 - INFO - [Thread 1887673] New thread, crawling forward 1→3...
2026-01-15 18:26:30,378 - INFO - [Thread 1942255] Found last_post_id at page 146, stopping...
2026-01-15 18:26:30,384 - INFO - [Thread 1942255] Final batch inserted 1/1 posts
2026-01-15 18:26:30,387 - INFO - [Thread 1942255] Collected 1 posts in 4.6s
2026-01-15 18:26:30,387 - INFO - Thu thập được 1 posts từ thread
2026-01-15 18:26:30,390 - INFO - [9/20] Crawl thread: Ngôi nhà nh trên Thảo Nguyên - P86...
2026-01-15 18:26:32,663 - INFO - [Thread 1942185] Existing thread, crawling reverse 523→1 until last_post_id: post-47878873
2026-01-15 18:26:34,987 - INFO - [Thread 1942185] Found last_post_id at page 523, stopping...
2026-01-15 18:26:34,995 - INFO - [Thread 1942185] Final batch inserted 2/2 posts
2026-01-15 18:26:34,996 - INFO - [Thread 1942185] Collected 2 posts in 4.6s
2026-01-15 18:26:34,996 - INFO - Thu thập được 2 posts từ thread
2026-01-15 18:26:34,998 - INFO - [10/20] Crawl thread: VEA:Tổng CT Máy động lực và máy Nông nghiệp VN- CP...
2026-01-15 18:26:35,109 - INFO - [Thread 1887673] Final batch inserted 22/22 posts
2026-01-15 18:26:35,111 - INFO - [Thread 1887673] Collected 22 posts in 9.1s
2026-01-15 18:26:35,111 - INFO - Thu thập được 22 posts từ thread
2026-01-15 18:26:35,114 - INFO - [11/20] Crawl thread: PHR - Sắp nhận đn bù 2-3k tỷ từ Thaco...
2026-01-15 18:26:37,305 - INFO - [Thread 1835579] Existing thread, crawling reverse 376→1 until last_post_id: post-47878883
2026-01-15 18:26:37,504 - INFO - [Thread 1918203] Existing thread, crawling reverse 240→1 until last_post_id: post-47878881
2026-01-15 18:26:39,555 - INFO - [Thread 1835579] Found last_post_id at page 376, stopping...
2026-01-15 18:26:39,556 - INFO - [Thread 1835579] Collected 0 posts in 4.6s
2026-01-15 18:26:39,556 - INFO - Thu thập được 0 posts từ thread
2026-01-15 18:26:39,558 - INFO - [12/20] Crawl thread: Tất cả các dòng sông đu chảy - P2...
2026-01-15 18:26:39,818 - INFO - [Thread 1918203] Found last_post_id at page 240, stopping...
2026-01-15 18:26:39,819 - INFO - [Thread 1918203] Collected 0 posts in 4.7s
2026-01-15 18:26:39,819 - INFO - Thu thập được 0 posts từ thread
2026-01-15 18:26:39,822 - INFO - [13/20] Crawl thread: Bđs bắt đáy...
2026-01-15 18:26:41,861 - INFO - [Thread 1934311] Existing thread, crawling reverse 102→1 until last_post_id: post-47878879
2026-01-15 18:26:42,130 - INFO - [Thread 1940685] Existing thread, crawling reverse 50→1 until last_post_id: post-47878877
2026-01-15 18:26:44,200 - INFO - [Thread 1934311] Found last_post_id at page 102, stopping...
2026-01-15 18:26:44,200 - INFO - [Thread 1934311] Collected 0 posts in 4.6s
2026-01-15 18:26:44,201 - INFO - Thu thập được 0 posts từ thread
2026-01-15 18:26:44,203 - INFO - [14/20] Crawl thread: STB - Cổ phiếu kịch hay đang đên hồi cao trào(...
2026-01-15 18:26:44,363 - INFO - [Thread 1940685] Found last_post_id at page 50, stopping...
2026-01-15 18:26:44,366 - INFO - [Thread 1940685] Collected 0 posts in 4.5s
2026-01-15 18:26:44,367 - INFO - Thu thập được 0 posts từ thread
2026-01-15 18:26:44,372 - INFO - [15/20] Crawl thread: DVN lên được bao nhiêu mi ngưi...
2026-01-15 18:26:46,539 - INFO - [Thread 1930607] Existing thread, crawling reverse 133→1 until last_post_id: post-47878853
2026-01-15 18:26:46,599 - INFO - [Thread 1943935] Existing thread, crawling reverse 1→1 until last_post_id: post-47878841
2026-01-15 18:26:48,800 - INFO - [Thread 1943935] Found last_post_id at page 1, stopping...
2026-01-15 18:26:48,800 - INFO - [Thread 1943935] Collected 0 posts in 4.4s
2026-01-15 18:26:48,801 - INFO - Thu thập được 0 posts từ thread
2026-01-15 18:26:48,803 - INFO - [16/20] Crawl thread: VIX: quân bài tẩy h nhà M...
2026-01-15 18:26:48,913 - INFO - [Thread 1930607] Found last_post_id at page 133, stopping...
2026-01-15 18:26:48,914 - INFO - [Thread 1930607] Collected 0 posts in 4.7s
2026-01-15 18:26:48,915 - INFO - Thu thập được 0 posts từ thread
2026-01-15 18:26:48,917 - INFO - [17/20] Crawl thread: HPG- Sự trở lại của nhà Vua...
2026-01-15 18:26:51,278 - INFO - [Thread 1903403] Existing thread, crawling reverse 559→1 until last_post_id: post-47878837
2026-01-15 18:26:51,326 - INFO - [Thread 1925045] Existing thread, crawling reverse 266→1 until last_post_id: post-47878835
2026-01-15 18:26:53,488 - INFO - [Thread 1903403] Found last_post_id at page 559, stopping...
2026-01-15 18:26:53,488 - INFO - [Thread 1903403] Collected 0 posts in 4.7s
2026-01-15 18:26:53,489 - INFO - Thu thập được 0 posts từ thread
2026-01-15 18:26:53,490 - INFO - [18/20] Crawl thread: SZL-có xứng đáng để đầu tư?...
2026-01-15 18:26:53,586 - INFO - [Thread 1925045] Found last_post_id at page 266, stopping...
2026-01-15 18:26:53,587 - INFO - [Thread 1925045] Collected 0 posts in 4.7s
2026-01-15 18:26:53,587 - INFO - Thu thập được 0 posts từ thread
2026-01-15 18:26:53,591 - INFO - [19/20] Crawl thread: VNI - vươn mình 1954 or 1975...
2026-01-15 18:26:55,819 - INFO - [Thread 1293301] Existing thread, crawling reverse 752→1 until last_post_id: post-47878833
2026-01-15 18:26:55,892 - INFO - [Thread 1936901] Existing thread, crawling reverse 263→1 until last_post_id: post-47878775
2026-01-15 18:26:58,072 - INFO - [Thread 1293301] Found last_post_id at page 752, stopping...
2026-01-15 18:26:58,073 - INFO - [Thread 1293301] Collected 0 posts in 4.6s
2026-01-15 18:26:58,074 - INFO - Thu thập được 0 posts từ thread
2026-01-15 18:26:58,075 - INFO - [20/20] Crawl thread: 14.1 không nên phức tạp quá - múc là có ăn...
2026-01-15 18:26:58,219 - INFO - [Thread 1936901] Found last_post_id at page 263, stopping...
2026-01-15 18:26:58,220 - INFO - [Thread 1936901] Collected 0 posts in 4.6s
2026-01-15 18:26:58,220 - INFO - Thu thập được 0 posts từ thread
2026-01-15 18:27:00,370 - INFO - [Thread 1943725] Existing thread, crawling reverse 6→1 until last_post_id: post-47878829
2026-01-15 18:27:02,699 - INFO - [Thread 1943725] Found last_post_id at page 6, stopping...
2026-01-15 18:27:02,700 - INFO - [Thread 1943725] Collected 0 posts in 4.6s
2026-01-15 18:27:02,701 - INFO - Thu thập được 0 posts từ thread
2026-01-15 18:27:02,703 - INFO - Hoàn thành trang 1, tổng posts: 33
2026-01-15 18:27:17,293 - INFO - ang xử lý trang 2
2026-01-15 18:27:22,850 - INFO - Tìm thấy 20 threads trên trang 2
2026-01-15 18:27:27,633 - INFO - ã thu thập thông tin 20 threads, bắt đầu crawl posts...
2026-01-15 18:27:27,638 - INFO - [1/20] Crawl thread: Game mới SHB. Múc mạnh để mua nhà mua xe...
2026-01-15 18:27:27,639 - INFO - [2/20] Crawl thread: TTN - DN viễn thông vốn hoá 200 tỷ và hợp đồng gần...
2026-01-15 18:27:29,938 - INFO - [Thread 1900397] Existing thread, crawling reverse 536→1 until last_post_id: post-47878817
2026-01-15 18:27:30,891 - INFO - [Thread 1303829] Existing thread, crawling reverse 72→1 until last_post_id: post-47878815
2026-01-15 18:27:32,232 - INFO - [Thread 1900397] Found last_post_id at page 536, stopping...
2026-01-15 18:27:32,232 - INFO - [Thread 1900397] Collected 0 posts in 4.6s
2026-01-15 18:27:32,233 - INFO - Thu thập được 0 posts từ thread
2026-01-15 18:27:32,237 - INFO - [3/20] Crawl thread: CTI có gì?...
2026-01-15 18:27:33,183 - INFO - [Thread 1303829] Found last_post_id at page 72, stopping...
2026-01-15 18:27:33,184 - INFO - [Thread 1303829] Collected 0 posts in 5.5s
2026-01-15 18:27:33,184 - INFO - Thu thập được 0 posts từ thread
2026-01-15 18:27:33,192 - INFO - [4/20] Crawl thread: Công ty vốn hoá 900 tỷ tin mặt 3000 tỷ...
2026-01-15 18:27:34,644 - INFO - [Thread 1911395] Existing thread, crawling reverse 39→1 until last_post_id: post-47878813
2026-01-15 18:27:35,497 - INFO - [Thread 1902081] Existing thread, crawling reverse 20→1 until last_post_id: post-47878809
2026-01-15 18:27:36,967 - INFO - [Thread 1911395] Found last_post_id at page 39, stopping...
2026-01-15 18:27:36,968 - INFO - [Thread 1911395] Collected 0 posts in 4.7s
2026-01-15 18:27:36,969 - INFO - Thu thập được 0 posts từ thread
2026-01-15 18:27:36,973 - INFO - [5/20] Crawl thread: Topic cổ đông dài hạn Nhiệt điện Quảng Ninh - ầu ...
2026-01-15 18:27:37,832 - INFO - [Thread 1902081] Found last_post_id at page 20, stopping...
2026-01-15 18:27:37,833 - INFO - [Thread 1902081] Collected 0 posts in 4.6s
2026-01-15 18:27:37,834 - INFO - Thu thập được 0 posts từ thread
2026-01-15 18:27:37,837 - INFO - [6/20] Crawl thread: FOC - Viên kim cương bị lãng quên - Trỗi dậy cùng ...
2026-01-15 18:27:39,320 - INFO - [Thread 1943359] Existing thread, crawling reverse 2→1 until last_post_id: post-47878803
2026-01-15 18:27:40,215 - INFO - [Thread 1912015] Existing thread, crawling reverse 13→1 until last_post_id: post-47878789
2026-01-15 18:27:41,638 - INFO - [Thread 1943359] Found last_post_id at page 2, stopping...
2026-01-15 18:27:41,640 - INFO - [Thread 1943359] Collected 0 posts in 4.7s
2026-01-15 18:27:41,641 - INFO - Thu thập được 0 posts từ thread
2026-01-15 18:27:41,643 - INFO - [7/20] Crawl thread: Sóng Uptrend tốt nhất chu kỳ dự kiến 2026 +3-6 thá...
2026-01-15 18:27:42,514 - INFO - [Thread 1912015] Found last_post_id at page 13, stopping...
2026-01-15 18:27:42,515 - INFO - [Thread 1912015] Collected 0 posts in 4.7s
2026-01-15 18:27:42,516 - INFO - Thu thập được 0 posts từ thread
2026-01-15 18:27:42,519 - INFO - [8/20] Crawl thread: Thanh khoản...
2026-01-15 18:27:43,991 - INFO - [Thread 1942299] Existing thread, crawling reverse 23→1 until last_post_id: post-47878781
2026-01-15 18:27:44,811 - INFO - [Thread 1943459] Existing thread, crawling reverse 7→1 until last_post_id: post-47878763
2026-01-15 18:27:46,271 - INFO - [Thread 1942299] Found last_post_id at page 23, stopping...
2026-01-15 18:27:46,272 - INFO - [Thread 1942299] Collected 0 posts in 4.6s
2026-01-15 18:27:46,272 - INFO - Thu thập được 0 posts từ thread
2026-01-15 18:27:46,273 - INFO - [9/20] Crawl thread: Săn lùng cổ phiếu PENNY đột biến 2026!...
2026-01-15 18:27:47,100 - INFO - [Thread 1943459] Found last_post_id at page 7, stopping...
2026-01-15 18:27:47,104 - INFO - [Thread 1943459] Collected 0 posts in 4.6s
2026-01-15 18:27:47,105 - INFO - Thu thập được 0 posts từ thread
2026-01-15 18:27:47,108 - INFO - [10/20] Crawl thread: HDG lợi nhuận nghìn tỷ vượt kế hoạch 2023...
2026-01-15 18:27:48,655 - INFO - [Thread 1943779] Existing thread, crawling reverse 6→1 until last_post_id: post-47878773
2026-01-15 18:27:49,423 - INFO - [Thread 1857501] Existing thread, crawling reverse 504→1 until last_post_id: post-47878767
2026-01-15 18:27:51,095 - INFO - [Thread 1943779] Found last_post_id at page 6, stopping...
2026-01-15 18:27:51,097 - INFO - [Thread 1943779] Collected 0 posts in 4.8s
2026-01-15 18:27:51,098 - INFO - Thu thập được 0 posts từ thread
2026-01-15 18:27:51,100 - INFO - [11/20] Crawl thread: Làm gì có sóng cổ phiếu ngân hàng lúc này…...
2026-01-15 18:27:51,756 - INFO - [Thread 1857501] Found last_post_id at page 504, stopping...
2026-01-15 18:27:51,758 - INFO - [Thread 1857501] Collected 0 posts in 4.6s
2026-01-15 18:27:51,759 - INFO - Thu thập được 0 posts từ thread
2026-01-15 18:27:51,762 - INFO - [12/20] Crawl thread: BSR tin mặt 42.000 tỷ, chia cổ tức 61,5%, bóng dá...
2026-01-15 18:27:53,466 - INFO - [Thread 1943823] Existing thread, crawling reverse 7→1 until last_post_id: post-47878749
2026-01-15 18:27:54,148 - INFO - [Thread 1927427] Existing thread, crawling reverse 70→1 until last_post_id: post-47878743
2026-01-15 18:27:55,737 - INFO - [Thread 1943823] Found last_post_id at page 7, stopping...
2026-01-15 18:27:55,737 - INFO - [Thread 1943823] Collected 0 posts in 4.6s
2026-01-15 18:27:55,738 - INFO - Thu thập được 0 posts từ thread
2026-01-15 18:27:55,740 - INFO - [13/20] Crawl thread: QCG: liệu có một trận đánh lớn?...
2026-01-15 18:27:56,364 - INFO - [Thread 1927427] Found last_post_id at page 70, stopping...
2026-01-15 18:27:56,365 - INFO - [Thread 1927427] Collected 0 posts in 4.6s
2026-01-15 18:27:56,365 - INFO - Thu thập được 0 posts từ thread
2026-01-15 18:27:56,368 - INFO - [14/20] Crawl thread: Xin 3 chữ cái cho năm 2026......
2026-01-15 18:27:58,070 - INFO - [Thread 1943743] Existing thread, crawling reverse 2→1 until last_post_id: post-47878739
2026-01-15 18:27:58,668 - INFO - [Thread 1943931] Existing thread, crawling reverse 1→1 until last_post_id: post-47878693
2026-01-15 18:28:00,374 - INFO - [Thread 1943743] Found last_post_id at page 2, stopping...
2026-01-15 18:28:00,374 - INFO - [Thread 1943743] Collected 0 posts in 4.6s
2026-01-15 18:28:00,375 - INFO - Thu thập được 0 posts từ thread
2026-01-15 18:28:00,376 - INFO - [15/20] Crawl thread: BIDV chào bán riêng lẻ với giá 38,900 đồng/cp...
2026-01-15 18:28:00,907 - INFO - [Thread 1943931] Found last_post_id at page 1, stopping...
2026-01-15 18:28:00,908 - INFO - [Thread 1943931] Collected 0 posts in 4.5s
2026-01-15 18:28:00,908 - INFO - Thu thập được 0 posts từ thread
2026-01-15 18:28:00,911 - INFO - [16/20] Crawl thread: Khuyến nghị mua VIX...
2026-01-15 18:28:02,707 - INFO - [Thread 1943821] Existing thread, crawling reverse 8→1 until last_post_id: post-47878339
2026-01-15 18:28:03,220 - INFO - [Thread 1902573] Existing thread, crawling reverse 48→1 until last_post_id: post-47878683
2026-01-15 18:28:05,005 - INFO - [Thread 1943821] Found last_post_id at page 8, stopping...
2026-01-15 18:28:05,006 - INFO - [Thread 1943821] Collected 0 posts in 4.6s
2026-01-15 18:28:05,006 - INFO - Thu thập được 0 posts từ thread
2026-01-15 18:28:05,007 - INFO - [17/20] Crawl thread: Các cổ phiếu nhà nước cầm trên 80% mà giá chưa tăn...
2026-01-15 18:28:05,487 - INFO - [Thread 1902573] Found last_post_id at page 48, stopping...
2026-01-15 18:28:05,487 - INFO - [Thread 1902573] Collected 0 posts in 4.6s
2026-01-15 18:28:05,488 - INFO - Thu thập được 0 posts từ thread
2026-01-15 18:28:05,490 - INFO - [18/20] Crawl thread: VOS-vào sóng !...
2026-01-15 18:28:07,398 - INFO - [Thread 1943905] Existing thread, crawling reverse 2→1 until last_post_id: post-47877865
2026-01-15 18:28:07,823 - INFO - [Thread 1942127] Existing thread, crawling reverse 9→1 until last_post_id: post-47878621
2026-01-15 18:28:09,686 - INFO - [Thread 1943905] Found last_post_id at page 2, stopping...
2026-01-15 18:28:09,687 - INFO - [Thread 1943905] Collected 0 posts in 4.7s
2026-01-15 18:28:09,687 - INFO - Thu thập được 0 posts từ thread
2026-01-15 18:28:09,689 - INFO - [19/20] Crawl thread: 2026: Dự ỉnh 1960- áy 1340. Cơ hội nào cho NT...
2026-01-15 18:28:10,114 - INFO - [Thread 1942127] Found last_post_id at page 9, stopping...
2026-01-15 18:28:10,114 - INFO - [Thread 1942127] Collected 0 posts in 4.6s
2026-01-15 18:28:10,114 - INFO - Thu thập được 0 posts từ thread
2026-01-15 18:28:10,116 - INFO - [20/20] Crawl thread: 15/1 bắt đáy...
2026-01-15 18:28:12,099 - INFO - [Thread 1942323] Existing thread, crawling reverse 31→1 until last_post_id: post-47878221
2026-01-15 18:28:12,378 - INFO - [Thread 1943867] Existing thread, crawling reverse 3→1 until last_post_id: post-47878601
2026-01-15 18:28:14,414 - INFO - [Thread 1942323] Found last_post_id at page 31, stopping...
2026-01-15 18:28:14,414 - INFO - [Thread 1942323] Collected 0 posts in 4.7s
2026-01-15 18:28:14,415 - INFO - Thu thập được 0 posts từ thread
2026-01-15 18:28:14,870 - INFO - [Thread 1943867] Found last_post_id at page 3, stopping...
2026-01-15 18:28:14,871 - INFO - [Thread 1943867] Collected 0 posts in 4.8s
2026-01-15 18:28:14,872 - INFO - Thu thập được 0 posts từ thread
2026-01-15 18:28:14,873 - INFO - Hoàn thành trang 2, tổng posts: 33
2026-01-15 18:28:26,651 - INFO - ang xử lý trang 3
2026-01-15 18:28:31,848 - INFO - Tìm thấy 20 threads trên trang 3
2026-01-15 18:28:35,018 - INFO - ã thu thập thông tin 20 threads, bắt đầu crawl posts...
2026-01-15 18:28:35,020 - INFO - [1/20] Crawl thread: VCI target 41.5, 44.5, 47.5...hết sóng 52 - 58...
2026-01-15 18:28:35,020 - INFO - [2/20] Crawl thread: Gía mục tiêu cp ……..siêu sóng ….siêu sóng……….....
2026-01-15 18:28:37,322 - INFO - [Thread 1943745] Existing thread, crawling reverse 2→1 until last_post_id: post-47878583
2026-01-15 18:28:37,331 - INFO - [Thread 1943853] Existing thread, crawling reverse 3→1 until last_post_id: post-47878595
2026-01-15 18:28:39,548 - INFO - [Thread 1943853] Found last_post_id at page 3, stopping...
2026-01-15 18:28:39,549 - INFO - [Thread 1943853] Collected 0 posts in 4.5s
2026-01-15 18:28:39,549 - INFO - Thu thập được 0 posts từ thread
2026-01-15 18:28:39,552 - INFO - [3/20] Crawl thread: BID: Tăng một mạch 7 phiên 40%...
2026-01-15 18:28:39,639 - INFO - [Thread 1943745] Found last_post_id at page 2, stopping...
2026-01-15 18:28:39,639 - INFO - [Thread 1943745] Collected 0 posts in 4.6s
2026-01-15 18:28:39,640 - INFO - Thu thập được 0 posts từ thread
2026-01-15 18:28:39,643 - INFO - [4/20] Crawl thread: Lạm bàn v Cảng à Nẵng - CDN...
2026-01-15 18:28:41,855 - INFO - [Thread 1943741] Existing thread, crawling reverse 1→1 until last_post_id: post-47878569
2026-01-15 18:28:41,974 - INFO - [Thread 1883213] Existing thread, crawling reverse 28→1 until last_post_id: post-47878553
2026-01-15 18:28:44,148 - INFO - [Thread 1943741] Found last_post_id at page 1, stopping...
2026-01-15 18:28:44,151 - INFO - [Thread 1943741] Collected 0 posts in 4.6s
2026-01-15 18:28:44,151 - INFO - Thu thập được 0 posts từ thread
2026-01-15 18:28:44,154 - INFO - [5/20] Crawl thread: THG-Những nốt thăng trầm...
2026-01-15 18:28:44,270 - INFO - [Thread 1883213] Found last_post_id at page 28, stopping...
2026-01-15 18:28:44,271 - INFO - [Thread 1883213] Collected 0 posts in 4.6s
2026-01-15 18:28:44,272 - INFO - Thu thập được 0 posts từ thread
2026-01-15 18:28:44,277 - INFO - [6/20] Crawl thread: DCM - Liên tục phá đỉnh 2025-2026...
2026-01-15 18:28:46,569 - INFO - [Thread 1924015] Existing thread, crawling reverse 94→1 until last_post_id: post-47878551
2026-01-15 18:28:46,610 - INFO - [Thread 1929137] Existing thread, crawling reverse 53→1 until last_post_id: post-47878547
2026-01-15 18:28:48,918 - INFO - [Thread 1924015] Found last_post_id at page 94, stopping...
2026-01-15 18:28:48,928 - INFO - [Thread 1929137] Found last_post_id at page 53, stopping...
2026-01-15 18:28:48,928 - INFO - [Thread 1924015] Collected 0 posts in 4.8s
2026-01-15 18:28:48,929 - INFO - Thu thập được 0 posts từ thread
2026-01-15 18:28:48,928 - INFO - [Thread 1929137] Collected 0 posts in 4.6s
2026-01-15 18:28:48,930 - INFO - Thu thập được 0 posts từ thread
2026-01-15 18:28:48,932 - INFO - [7/20] Crawl thread: VNM Cơ hội đang rất rõ ràng !...
2026-01-15 18:28:48,939 - INFO - [8/20] Crawl thread: HDB- Tiếp tục hành trình chinh phục những đỉnh cao...
2026-01-15 18:28:51,229 - INFO - [Thread 1926367] Existing thread, crawling reverse 175→1 until last_post_id: post-47878521
2026-01-15 18:28:51,325 - INFO - [Thread 1943915] Existing thread, crawling reverse 3→1 until last_post_id: post-47878239
2026-01-15 18:28:53,476 - INFO - [Thread 1926367] Found last_post_id at page 175, stopping...
2026-01-15 18:28:53,477 - INFO - [Thread 1926367] Collected 0 posts in 4.5s
2026-01-15 18:28:53,477 - INFO - Thu thập được 0 posts từ thread
2026-01-15 18:28:53,480 - INFO - [9/20] Crawl thread: HID sẽ lại X5 từ vùng giá 4.x ???...
2026-01-15 18:28:53,695 - INFO - [Thread 1943915] Found last_post_id at page 3, stopping...
2026-01-15 18:28:53,696 - INFO - [Thread 1943915] Collected 0 posts in 4.8s
2026-01-15 18:28:53,696 - INFO - Thu thập được 0 posts từ thread
2026-01-15 18:28:53,698 - INFO - [10/20] Crawl thread: Index Ký Sự - P3...
2026-01-15 18:28:55,838 - INFO - [Thread 1943407] Existing thread, crawling reverse 19→1 until last_post_id: post-47878429
2026-01-15 18:28:56,044 - INFO - [Thread 1942309] Existing thread, crawling reverse 7→1 until last_post_id: post-47878535
2026-01-15 18:28:58,187 - INFO - [Thread 1943407] Found last_post_id at page 19, stopping...
2026-01-15 18:28:58,189 - INFO - [Thread 1943407] Collected 0 posts in 4.7s
2026-01-15 18:28:58,190 - INFO - Thu thập được 0 posts từ thread
2026-01-15 18:28:58,193 - INFO - [11/20] Crawl thread: List thoái vốn SCIC update...
2026-01-15 18:28:58,340 - INFO - [Thread 1942309] Found last_post_id at page 7, stopping...
2026-01-15 18:28:58,341 - INFO - [Thread 1942309] Collected 0 posts in 4.6s
2026-01-15 18:28:58,342 - INFO - Thu thập được 0 posts từ thread
2026-01-15 18:28:58,345 - INFO - [12/20] Crawl thread: Nghành Dầu khí sẽ dẫn sóng cho năm 2026?...
2026-01-15 18:29:00,453 - INFO - [Thread 1943921] Existing thread, crawling reverse 1→1 until last_post_id: post-47877983
2026-01-15 18:29:00,688 - INFO - [Thread 1942541] Existing thread, crawling reverse 5→1 until last_post_id: post-47878507
2026-01-15 18:29:02,703 - INFO - [Thread 1943921] Found last_post_id at page 1, stopping...
2026-01-15 18:29:02,704 - INFO - [Thread 1943921] Collected 0 posts in 4.5s
2026-01-15 18:29:02,704 - INFO - Thu thập được 0 posts từ thread
2026-01-15 18:29:02,705 - INFO - [13/20] Crawl thread: Ngành cao su (GVR, PHR,...) và NQ79...
2026-01-15 18:29:02,949 - INFO - [Thread 1942541] Found last_post_id at page 5, stopping...
2026-01-15 18:29:02,950 - INFO - [Thread 1942541] Collected 0 posts in 4.6s
2026-01-15 18:29:02,950 - INFO - Thu thập được 0 posts từ thread
2026-01-15 18:29:02,952 - INFO - [14/20] Crawl thread: DGC con hào kinh tế...
2026-01-15 18:29:05,035 - INFO - [Thread 1943285] Existing thread, crawling reverse 6→1 until last_post_id: post-47878503
2026-01-15 18:29:05,487 - INFO - [Thread 1943403] Existing thread, crawling reverse 5→1 until last_post_id: post-47878459
2026-01-15 18:29:07,300 - INFO - [Thread 1943285] Found last_post_id at page 6, stopping...
2026-01-15 18:29:07,300 - INFO - [Thread 1943285] Collected 0 posts in 4.6s
2026-01-15 18:29:07,301 - INFO - Thu thập được 0 posts từ thread
2026-01-15 18:29:07,303 - INFO - [15/20] Crawl thread: Căng đét...
2026-01-15 18:29:07,758 - INFO - [Thread 1943403] Found last_post_id at page 5, stopping...
2026-01-15 18:29:07,758 - INFO - [Thread 1943403] Collected 0 posts in 4.8s
2026-01-15 18:29:07,759 - INFO - Thu thập được 0 posts từ thread
2026-01-15 18:29:07,761 - INFO - [16/20] Crawl thread: Cuối năm 2025, thoát xu hướng tích luỹ...
2026-01-15 18:29:09,514 - INFO - [Thread 1943929] Existing thread, crawling reverse 1→1 until last_post_id: post-47878457
2026-01-15 18:29:10,044 - INFO - [Thread 1936049] Existing thread, crawling reverse 8→1 until last_post_id: post-47878445
2026-01-15 18:29:11,756 - INFO - [Thread 1943929] Found last_post_id at page 1, stopping...
2026-01-15 18:29:11,757 - INFO - [Thread 1943929] Collected 0 posts in 4.5s
2026-01-15 18:29:11,758 - INFO - Thu thập được 0 posts từ thread
2026-01-15 18:29:11,760 - INFO - [17/20] Crawl thread: CII hưởng lợi lớn nhất đấu giá đất Thủ Thiêm...
2026-01-15 18:29:12,306 - INFO - [Thread 1936049] Found last_post_id at page 8, stopping...
2026-01-15 18:29:12,307 - INFO - [Thread 1936049] Collected 0 posts in 4.5s
2026-01-15 18:29:12,307 - INFO - Thu thập được 0 posts từ thread
2026-01-15 18:29:12,309 - INFO - [18/20] Crawl thread: EVF Doanh nghiệp tăng trưởng...
2026-01-15 18:29:14,106 - INFO - [Thread 1705091] Existing thread, crawling reverse 213→1 until last_post_id: post-47878425
2026-01-15 18:29:14,637 - INFO - [Thread 1935667] Existing thread, crawling reverse 4→1 until last_post_id: post-47878423
2026-01-15 18:29:16,357 - INFO - [Thread 1705091] Found last_post_id at page 213, stopping...
2026-01-15 18:29:16,357 - INFO - [Thread 1705091] Collected 0 posts in 4.6s
2026-01-15 18:29:16,357 - INFO - Thu thập được 0 posts từ thread
2026-01-15 18:29:16,359 - INFO - [19/20] Crawl thread: Tam tấu SSI - VIX - CTS ! Siêu game bom tấn!...
2026-01-15 18:29:16,895 - INFO - [Thread 1935667] Found last_post_id at page 4, stopping...
2026-01-15 18:29:16,896 - INFO - [Thread 1935667] Collected 0 posts in 4.6s
2026-01-15 18:29:16,897 - INFO - Thu thập được 0 posts từ thread
2026-01-15 18:29:16,899 - INFO - [20/20] Crawl thread: Thép-ã đến lúc...
2026-01-15 18:29:18,660 - INFO - [Thread 1923417] Existing thread, crawling reverse 296→1 until last_post_id: post-47878409
2026-01-15 18:29:19,213 - INFO - [Thread 1943755] Existing thread, crawling reverse 6→1 until last_post_id: post-47878407
2026-01-15 18:29:20,910 - INFO - [Thread 1923417] Found last_post_id at page 296, stopping...
2026-01-15 18:29:20,911 - INFO - [Thread 1923417] Collected 0 posts in 4.6s
2026-01-15 18:29:20,912 - INFO - Thu thập được 0 posts từ thread
2026-01-15 18:29:21,470 - INFO - [Thread 1943755] Found last_post_id at page 6, stopping...
2026-01-15 18:29:21,471 - INFO - [Thread 1943755] Collected 0 posts in 4.6s
2026-01-15 18:29:21,472 - INFO - Thu thập được 0 posts từ thread
2026-01-15 18:29:21,474 - INFO - Hoàn thành trang 3, tổng posts: 33
2026-01-15 18:29:33,719 - INFO - ang xử lý trang 4
2026-01-15 18:29:38,855 - INFO - Tìm thấy 20 threads trên trang 4
2026-01-15 18:29:43,075 - INFO - ã thu thập thông tin 20 threads, bắt đầu crawl posts...
2026-01-15 18:29:43,078 - INFO - [1/20] Crawl thread: Dòng tin lan toả bước sang năm 2026...
2026-01-15 18:29:43,079 - INFO - [2/20] Crawl thread: HAG - sắp sang trang mới cổ phiếu vươn mình tăng t...
2026-01-15 18:29:45,414 - INFO - [Thread 1942743] Existing thread, crawling reverse 6→1 until last_post_id: post-47878399
2026-01-15 18:29:46,339 - INFO - [Thread 1935815] Existing thread, crawling reverse 105→1 until last_post_id: post-47878379
2026-01-15 18:29:47,675 - INFO - [Thread 1942743] Found last_post_id at page 6, stopping...
2026-01-15 18:29:47,677 - INFO - [Thread 1942743] Collected 0 posts in 4.6s
2026-01-15 18:29:47,678 - INFO - Thu thập được 0 posts từ thread
2026-01-15 18:29:47,681 - INFO - [3/20] Crawl thread: BBC: Chia cổ tức kỷ lục 373,5%...
2026-01-15 18:29:48,758 - INFO - [Thread 1935815] Found last_post_id at page 105, stopping...
2026-01-15 18:29:48,760 - INFO - [Thread 1935815] Collected 0 posts in 5.7s
2026-01-15 18:29:48,769 - INFO - Thu thập được 0 posts từ thread
2026-01-15 18:29:48,772 - INFO - [4/20] Crawl thread: PGV - Khủng long ngành điện...
2026-01-15 18:29:50,043 - INFO - [Thread 1943807] Existing thread, crawling reverse 4→1 until last_post_id: post-47878181
2026-01-15 18:29:51,096 - INFO - [Thread 1550217] Existing thread, crawling reverse 253→1 until last_post_id: post-47878345
2026-01-15 18:29:52,318 - INFO - [Thread 1943807] Found last_post_id at page 4, stopping...
2026-01-15 18:29:52,320 - INFO - [Thread 1943807] Collected 0 posts in 4.6s
2026-01-15 18:29:52,320 - INFO - Thu thập được 0 posts từ thread
2026-01-15 18:29:52,323 - INFO - [5/20] Crawl thread: NT2 - Góc nhìn v giá trị!!!...
2026-01-15 18:29:53,426 - INFO - [Thread 1550217] Found last_post_id at page 253, stopping...
2026-01-15 18:29:53,463 - INFO - [Thread 1550217] Collected 0 posts in 4.7s
2026-01-15 18:29:53,464 - INFO - Thu thập được 0 posts từ thread
2026-01-15 18:29:53,467 - INFO - [6/20] Crawl thread: HNG Hướng tới vùng 20...
2026-01-15 18:29:54,627 - INFO - [Thread 1935045] Existing thread, crawling reverse 6→1 until last_post_id: post-47878307
2026-01-15 18:29:55,785 - INFO - [Thread 1910241] Existing thread, crawling reverse 149→1 until last_post_id: post-47878235
2026-01-15 18:29:56,912 - INFO - [Thread 1935045] Found last_post_id at page 6, stopping...
2026-01-15 18:29:56,913 - INFO - [Thread 1935045] Collected 0 posts in 4.6s
2026-01-15 18:29:56,913 - INFO - Thu thập được 0 posts từ thread
2026-01-15 18:29:56,916 - INFO - [7/20] Crawl thread: ISH vs GHC – Cổ tức bằng tin ổn định và trn đi!...
2026-01-15 18:29:58,071 - INFO - [Thread 1910241] Found last_post_id at page 149, stopping...
2026-01-15 18:29:58,072 - INFO - [Thread 1910241] Collected 0 posts in 4.6s
2026-01-15 18:29:58,072 - INFO - Thu thập được 0 posts từ thread
2026-01-15 18:29:58,074 - INFO - [8/20] Crawl thread: VNM đạt lợi nhuận hơn +19%, gặp gỡ trực tiếp chuyê...
2026-01-15 18:29:59,294 - INFO - [Thread 1844081] Existing thread, crawling reverse 44→1 until last_post_id: post-47878229
2026-01-15 18:30:00,389 - INFO - [Thread 1943891] Existing thread, crawling reverse 1→1 until last_post_id: post-47877171
2026-01-15 18:30:01,582 - INFO - [Thread 1844081] Found last_post_id at page 44, stopping...
2026-01-15 18:30:01,583 - INFO - [Thread 1844081] Collected 0 posts in 4.7s
2026-01-15 18:30:01,584 - INFO - Thu thập được 0 posts từ thread
2026-01-15 18:30:01,587 - INFO - [9/20] Crawl thread: Nhận định thị trưng hàng ngày...
2026-01-15 18:30:02,671 - INFO - [Thread 1943891] Found last_post_id at page 1, stopping...
2026-01-15 18:30:02,672 - INFO - [Thread 1943891] Collected 0 posts in 4.6s
2026-01-15 18:30:02,673 - INFO - Thu thập được 0 posts từ thread
2026-01-15 18:30:02,677 - INFO - [10/20] Crawl thread: Vĩ mô ngành BS – Cơn bão lớn hay chỉ là khó khăn ...
2026-01-15 18:30:03,987 - INFO - [Thread 1806081] Existing thread, crawling reverse 122→1 until last_post_id: post-47878143
2026-01-15 18:30:05,090 - INFO - [Thread 1940867] Existing thread, crawling reverse 2→1 until last_post_id: post-47878133
2026-01-15 18:30:06,344 - INFO - [Thread 1806081] Found last_post_id at page 122, stopping...
2026-01-15 18:30:06,346 - INFO - [Thread 1806081] Collected 0 posts in 4.8s
2026-01-15 18:30:06,346 - INFO - Thu thập được 0 posts từ thread
2026-01-15 18:30:06,349 - INFO - [11/20] Crawl thread: Bất động sản...đến gi bắt đáy...
2026-01-15 18:30:07,433 - INFO - [Thread 1940867] Found last_post_id at page 2, stopping...
2026-01-15 18:30:07,433 - INFO - [Thread 1940867] Collected 0 posts in 4.8s
2026-01-15 18:30:07,433 - INFO - Thu thập được 0 posts từ thread
2026-01-15 18:30:07,435 - INFO - [12/20] Crawl thread: PVC - ơn vị số 1 trong mảng bảo dưỡng !...
2026-01-15 18:30:08,685 - INFO - [Thread 1943193] Existing thread, crawling reverse 5→1 until last_post_id: post-47877167
2026-01-15 18:30:10,019 - INFO - [Thread 1880851] Existing thread, crawling reverse 13→1 until last_post_id: post-47878105
2026-01-15 18:30:11,002 - INFO - [Thread 1943193] Found last_post_id at page 5, stopping...
2026-01-15 18:30:11,003 - INFO - [Thread 1943193] Collected 0 posts in 4.7s
2026-01-15 18:30:11,004 - INFO - Thu thập được 0 posts từ thread
2026-01-15 18:30:11,006 - INFO - [13/20] Crawl thread: PVC – Kỳ vng trở thành đơn vị số 1 trong mảng bảo...
2026-01-15 18:30:12,481 - INFO - [Thread 1880851] Found last_post_id at page 13, stopping...
2026-01-15 18:30:12,482 - INFO - [Thread 1880851] Collected 0 posts in 5.0s
2026-01-15 18:30:12,483 - INFO - Thu thập được 0 posts từ thread
2026-01-15 18:30:12,485 - INFO - [14/20] Crawl thread: Cổ phiếu VEA: Triển vng đầu tư như thế nào trong ...
2026-01-15 18:30:13,523 - INFO - [Thread 1943841] Existing thread, crawling reverse 1→1 until last_post_id: post-47878087
2026-01-15 18:30:15,381 - INFO - [Thread 1902277] Existing thread, crawling reverse 1→1 until last_post_id: post-47878067
2026-01-15 18:30:15,942 - INFO - [Thread 1943841] Found last_post_id at page 1, stopping...
2026-01-15 18:30:15,942 - INFO - [Thread 1943841] Collected 0 posts in 4.9s
2026-01-15 18:30:15,944 - INFO - Thu thập được 0 posts từ thread
2026-01-15 18:30:15,946 - INFO - [15/20] Crawl thread: Vinfast - Xe điện của ngưi Việt (P3)...
2026-01-15 18:30:17,663 - INFO - [Thread 1902277] Found last_post_id at page 1, stopping...
2026-01-15 18:30:17,664 - INFO - [Thread 1902277] Collected 0 posts in 5.2s
2026-01-15 18:30:17,665 - INFO - Thu thập được 0 posts từ thread
2026-01-15 18:30:17,667 - INFO - [16/20] Crawl thread: CSM - Bạn đưng tin cậy...
2026-01-15 18:30:18,300 - INFO - [Thread 1882039] Existing thread, crawling reverse 800→1 until last_post_id: post-47877845
2026-01-15 18:30:20,219 - INFO - [Thread 1928135] Existing thread, crawling reverse 81→1 until last_post_id: post-47878017
2026-01-15 18:30:20,601 - INFO - [Thread 1882039] Found last_post_id at page 800, stopping...
2026-01-15 18:30:20,602 - INFO - [Thread 1882039] Collected 0 posts in 4.7s
2026-01-15 18:30:20,603 - INFO - Thu thập được 0 posts từ thread
2026-01-15 18:30:20,604 - INFO - [17/20] Crawl thread: PSD - ầu tư giá trị, rẻ nhất dòng bán lẻ!...
2026-01-15 18:30:22,532 - INFO - [Thread 1928135] Found last_post_id at page 81, stopping...
2026-01-15 18:30:22,532 - INFO - [Thread 1928135] Collected 0 posts in 4.9s
2026-01-15 18:30:22,532 - INFO - Thu thập được 0 posts từ thread
2026-01-15 18:30:22,534 - INFO - [18/20] Crawl thread: DSH: sở hữu 58% BOT Hà Nội-Bắc Giang...
2026-01-15 18:30:22,938 - INFO - [Thread 1896567] Existing thread, crawling reverse 72→1 until last_post_id: post-47878007
2026-01-15 18:30:24,955 - INFO - [Thread 1943875] Existing thread, crawling reverse 1→1 until last_post_id: post-47877999
2026-01-15 18:30:25,219 - INFO - [Thread 1896567] Found last_post_id at page 72, stopping...
2026-01-15 18:30:25,219 - INFO - [Thread 1896567] Collected 0 posts in 4.6s
2026-01-15 18:30:25,219 - INFO - Thu thập được 0 posts từ thread
2026-01-15 18:30:25,221 - INFO - [19/20] Crawl thread: Quý I - ầu quý tích lũy để cuối quý bùng nổ...
2026-01-15 18:30:27,323 - INFO - [Thread 1943875] Found last_post_id at page 1, stopping...
2026-01-15 18:30:27,323 - INFO - [Thread 1943875] Collected 0 posts in 4.8s
2026-01-15 18:30:27,323 - INFO - Thu thập được 0 posts từ thread
2026-01-15 18:30:27,324 - INFO - [20/20] Crawl thread: VNM – Có đang trở lại đưng đua tăng trưởng?...
2026-01-15 18:30:28,273 - INFO - [Thread 1942287] Existing thread, crawling reverse 7→1 until last_post_id: post-47877981
2026-01-15 18:30:29,747 - INFO - [Thread 1943639] Existing thread, crawling reverse 2→1 until last_post_id: post-47877947
2026-01-15 18:30:30,567 - INFO - [Thread 1942287] Found last_post_id at page 7, stopping...
2026-01-15 18:30:30,569 - INFO - [Thread 1942287] Collected 0 posts in 5.3s
2026-01-15 18:30:30,569 - INFO - Thu thập được 0 posts từ thread
2026-01-15 18:30:32,102 - INFO - [Thread 1943639] Found last_post_id at page 2, stopping...
2026-01-15 18:30:32,102 - INFO - [Thread 1943639] Collected 0 posts in 4.8s
2026-01-15 18:30:32,103 - INFO - Thu thập được 0 posts từ thread
2026-01-15 18:30:32,105 - INFO - Hoàn thành trang 4, tổng posts: 33
2026-01-15 18:30:44,937 - INFO - ang xử lý trang 5
2026-01-15 18:30:50,134 - INFO - Tìm thấy 20 threads trên trang 5
2026-01-15 18:30:56,041 - INFO - ã thu thập thông tin 20 threads, bắt đầu crawl posts...
2026-01-15 18:30:56,044 - INFO - [1/20] Crawl thread: MSN - Gã khổng lồ hàng tiêu dùng thức giấc...
2026-01-15 18:30:56,045 - INFO - [2/20] Crawl thread: Game định giá lại tài sản quốc gia -------- Cá mập...
2026-01-15 18:30:58,488 - INFO - [Thread 1926185] Existing thread, crawling reverse 33→1 until last_post_id: post-47877923
2026-01-15 18:30:59,999 - INFO - [Thread 1936055] Existing thread, crawling reverse 10→1 until last_post_id: post-47876653
2026-01-15 18:31:00,746 - INFO - [Thread 1926185] Found last_post_id at page 33, stopping...
2026-01-15 18:31:00,747 - INFO - [Thread 1926185] Collected 0 posts in 4.7s
2026-01-15 18:31:00,747 - INFO - Thu thập được 0 posts từ thread
2026-01-15 18:31:00,750 - INFO - [3/20] Crawl thread: Qcg: Ngày không xa!...
2026-01-15 18:31:02,597 - INFO - [Thread 1936055] Found last_post_id at page 10, stopping...
2026-01-15 18:31:02,598 - INFO - [Thread 1936055] Collected 0 posts in 6.6s
2026-01-15 18:31:02,599 - INFO - Thu thập được 0 posts từ thread
2026-01-15 18:31:02,602 - INFO - [4/20] Crawl thread: ACB: Bị sao vậy?...
2026-01-15 18:31:03,150 - INFO - [Thread 1825273] Existing thread, crawling reverse 1629→1 until last_post_id: post-47877841
2026-01-15 18:31:04,983 - INFO - [Thread 1943721] Existing thread, crawling reverse 2→1 until last_post_id: post-47877833
2026-01-15 18:31:05,504 - INFO - [Thread 1825273] Found last_post_id at page 1629, stopping...
2026-01-15 18:31:05,505 - INFO - [Thread 1825273] Collected 0 posts in 4.8s
2026-01-15 18:31:05,505 - INFO - Thu thập được 0 posts từ thread
2026-01-15 18:31:05,509 - INFO - [5/20] Crawl thread: ACV.......
2026-01-15 18:31:07,329 - INFO - [Thread 1943721] Found last_post_id at page 2, stopping...
2026-01-15 18:31:07,330 - INFO - [Thread 1943721] Collected 0 posts in 4.7s
2026-01-15 18:31:07,331 - INFO - Thu thập được 0 posts từ thread
2026-01-15 18:31:07,333 - INFO - [6/20] Crawl thread: EIB mã duy nhất đi ngược thị trưng hôm nay...
2026-01-15 18:31:07,963 - INFO - [Thread 1941417] Existing thread, crawling reverse 9→1 until last_post_id: post-47877831
2026-01-15 18:31:09,812 - INFO - [Thread 1943887] Existing thread, crawling reverse 1→1 until last_post_id: post-47877821
2026-01-15 18:31:10,269 - INFO - [Thread 1941417] Found last_post_id at page 9, stopping...
2026-01-15 18:31:10,270 - INFO - [Thread 1941417] Collected 0 posts in 4.8s
2026-01-15 18:31:10,270 - INFO - Thu thập được 0 posts từ thread
2026-01-15 18:31:10,273 - INFO - [7/20] Crawl thread: Ai đỡ?...
2026-01-15 18:31:12,147 - INFO - [Thread 1943887] Found last_post_id at page 1, stopping...
2026-01-15 18:31:12,148 - INFO - [Thread 1943887] Collected 0 posts in 4.8s
2026-01-15 18:31:12,149 - INFO - Thu thập được 0 posts từ thread
2026-01-15 18:31:12,151 - INFO - [8/20] Crawl thread: Giá xăng lên gần 19.000 đồng một lít...
2026-01-15 18:31:12,673 - INFO - [Thread 1943877] Existing thread, crawling reverse 5→1 until last_post_id: post-47877133
2026-01-15 18:31:14,489 - INFO - [Thread 1943919] Existing thread, crawling reverse 1→1 until last_post_id: post-47877779
2026-01-15 18:31:15,038 - INFO - [Thread 1943877] Found last_post_id at page 5, stopping...
2026-01-15 18:31:15,039 - INFO - [Thread 1943877] Collected 0 posts in 4.8s
2026-01-15 18:31:15,039 - INFO - Thu thập được 0 posts từ thread
2026-01-15 18:31:15,041 - INFO - [9/20] Crawl thread: POW tăng vốn khủng có lập đỉnh mới...
2026-01-15 18:31:16,746 - INFO - [Thread 1943919] Found last_post_id at page 1, stopping...
2026-01-15 18:31:16,748 - INFO - [Thread 1943919] Collected 0 posts in 4.6s
2026-01-15 18:31:16,749 - INFO - Thu thập được 0 posts từ thread
2026-01-15 18:31:16,752 - INFO - [10/20] Crawl thread: vc7 best invest...
2026-01-15 18:31:17,376 - INFO - [Thread 1935387] Existing thread, crawling reverse 12→1 until last_post_id: post-47877789
2026-01-15 18:31:19,115 - INFO - [Thread 1894771] Existing thread, crawling reverse 85→1 until last_post_id: post-47877773
2026-01-15 18:31:19,699 - INFO - [Thread 1935387] Found last_post_id at page 12, stopping...
2026-01-15 18:31:19,737 - INFO - [Thread 1935387] Final batch inserted 1/1 posts
2026-01-15 18:31:19,740 - INFO - [Thread 1935387] Collected 1 posts in 4.7s
2026-01-15 18:31:19,741 - INFO - Thu thập được 1 posts từ thread
2026-01-15 18:31:19,744 - INFO - [11/20] Crawl thread: ACV- Hình trình vượt 100k/cp bắt đầu từ đây...
2026-01-15 18:31:21,346 - INFO - [Thread 1894771] Found last_post_id at page 85, stopping...
2026-01-15 18:31:21,346 - INFO - [Thread 1894771] Collected 0 posts in 4.6s
2026-01-15 18:31:21,347 - INFO - Thu thập được 0 posts từ thread
2026-01-15 18:31:21,348 - INFO - [12/20] Crawl thread: PC1 bắt đầu vào giai đoạn tăng trưởng vượt đỉnh tr...
2026-01-15 18:31:22,084 - INFO - [Thread 1940601] Existing thread, crawling reverse 12→1 until last_post_id: post-47877749
2026-01-15 18:31:23,713 - INFO - [Thread 1869901] Existing thread, crawling reverse 10→1 until last_post_id: post-47877715
2026-01-15 18:31:24,397 - INFO - [Thread 1940601] Found last_post_id at page 12, stopping...
2026-01-15 18:31:24,398 - INFO - [Thread 1940601] Collected 0 posts in 4.7s
2026-01-15 18:31:24,398 - INFO - Thu thập được 0 posts từ thread
2026-01-15 18:31:24,401 - INFO - [13/20] Crawl thread: Tổng Kết Lợi Nhuận 2025 + Tầm Nhìn 2026!!!...
2026-01-15 18:31:26,032 - INFO - [Thread 1869901] Found last_post_id at page 10, stopping...
2026-01-15 18:31:26,033 - INFO - [Thread 1869901] Collected 0 posts in 4.7s
2026-01-15 18:31:26,033 - INFO - Thu thập được 0 posts từ thread
2026-01-15 18:31:26,035 - INFO - [14/20] Crawl thread: Long giết short cuối phiên...
2026-01-15 18:31:26,812 - INFO - [Thread 1942149] Existing thread, crawling reverse 6→1 until last_post_id: post-47877661
2026-01-15 18:31:28,323 - INFO - [Thread 1943865] Existing thread, crawling reverse 2→1 until last_post_id: post-47877645
2026-01-15 18:31:29,164 - INFO - [Thread 1942149] Found last_post_id at page 6, stopping...
2026-01-15 18:31:29,165 - INFO - [Thread 1942149] Collected 0 posts in 4.8s
2026-01-15 18:31:29,166 - INFO - Thu thập được 0 posts từ thread
2026-01-15 18:31:29,168 - INFO - [15/20] Crawl thread: Nhu cầu bạch kim khan hiếm tăng vt, dự kiến tiếp ...
2026-01-15 18:31:30,644 - INFO - [Thread 1943865] Found last_post_id at page 2, stopping...
2026-01-15 18:31:30,645 - INFO - [Thread 1943865] Collected 0 posts in 4.6s
2026-01-15 18:31:30,646 - INFO - Thu thập được 0 posts từ thread
2026-01-15 18:31:30,649 - INFO - [16/20] Crawl thread: Bank cổ phần nay làm sao thế ???VIB, ACB, SHB, HDB...
2026-01-15 18:31:31,494 - INFO - [Thread 1943917] Existing thread, crawling reverse 1→1 until last_post_id: post-47877611
2026-01-15 18:31:33,137 - INFO - [Thread 1943633] Existing thread, crawling reverse 5→1 until last_post_id: post-47877605
2026-01-15 18:31:33,767 - INFO - [Thread 1943917] Found last_post_id at page 1, stopping...
2026-01-15 18:31:33,768 - INFO - [Thread 1943917] Collected 0 posts in 4.6s
2026-01-15 18:31:33,769 - INFO - Thu thập được 0 posts từ thread
2026-01-15 18:31:33,771 - INFO - [17/20] Crawl thread: VEA - Tổng Công ty Máy động lực và máy nông nghiệp...
2026-01-15 18:31:35,492 - INFO - [Thread 1943633] Found last_post_id at page 5, stopping...
2026-01-15 18:31:35,493 - INFO - [Thread 1943633] Collected 0 posts in 4.8s
2026-01-15 18:31:35,494 - INFO - Thu thập được 0 posts từ thread
2026-01-15 18:31:35,497 - INFO - [18/20] Crawl thread: HVT - Vững bước trên hành trình phát triển mới...
2026-01-15 18:31:36,204 - INFO - [Thread 1943517] Existing thread, crawling reverse 1→1 until last_post_id: post-47877591
2026-01-15 18:31:37,897 - INFO - [Thread 1919815] Existing thread, crawling reverse 5→1 until last_post_id: post-47877525
2026-01-15 18:31:38,577 - INFO - [Thread 1943517] Found last_post_id at page 1, stopping...
2026-01-15 18:31:38,578 - INFO - [Thread 1943517] Collected 0 posts in 4.8s
2026-01-15 18:31:38,579 - INFO - Thu thập được 0 posts từ thread
2026-01-15 18:31:38,581 - INFO - [19/20] Crawl thread: CIP....CIP....CIP.......Một Siêu phẩm.... Nhân 3 t...
2026-01-15 18:31:40,228 - INFO - [Thread 1919815] Found last_post_id at page 5, stopping...
2026-01-15 18:31:40,229 - INFO - [Thread 1919815] Collected 0 posts in 4.7s
2026-01-15 18:31:40,230 - INFO - Thu thập được 0 posts từ thread
2026-01-15 18:31:40,233 - INFO - [20/20] Crawl thread: Thiên Long Hóa Rồng?...
2026-01-15 18:31:40,927 - INFO - [Thread 1588287] Existing thread, crawling reverse 2→1 until last_post_id: post-47877523
2026-01-15 18:31:42,690 - INFO - [Thread 1861323] Existing thread, crawling reverse 26→1 until last_post_id: post-47877519
2026-01-15 18:31:43,256 - INFO - [Thread 1588287] Found last_post_id at page 2, stopping...
2026-01-15 18:31:43,257 - INFO - [Thread 1588287] Collected 0 posts in 4.7s
2026-01-15 18:31:43,257 - INFO - Thu thập được 0 posts từ thread
2026-01-15 18:31:45,025 - INFO - [Thread 1861323] Found last_post_id at page 26, stopping...
2026-01-15 18:31:45,025 - INFO - [Thread 1861323] Collected 0 posts in 4.8s
2026-01-15 18:31:45,026 - INFO - Thu thập được 0 posts từ thread
2026-01-15 18:31:45,028 - INFO - Hoàn thành trang 5, tổng posts: 34
2026-01-15 18:31:48,337 - INFO - ang xử lý trang 6
2026-01-15 18:31:58,354 - WARNING - Không tìm thấy nút next tại trang 6
2026-01-15 18:32:00,569 - INFO - Selenium driver stopped
2026-01-15 18:32:00,569 - INFO - Hoàn tất! Tổng cộng thu thập: 34 posts
2026-01-15 18:32:00,570 - INFO - ✅ Hybrid Crawler completed: 34 posts in 362.0s
2026-01-15 18:32:00,571 - INFO - 📊 Summary: 100 threads (1 new)
2026-01-15 18:32:00,577 - INFO - 🔄 Scheduler is running. Press Ctrl+C to stop.
2026-01-15 18:34:12,388 - INFO - Received signal 2, shutting down...
2026-01-15 18:34:12,389 - INFO - Scheduler has been shut down
2026-01-15 18:34:12,390 - INFO - 🛑 Scheduler stopped
