2026-01-15 20:19:11,207 - INFO - Log file created: logs/scheduler_2026-01-15_20-19-11.log
2026-01-15 20:19:11,300 - INFO - Connected to PostgreSQL: f319_data
2026-01-15 20:19:11,355 - INFO - Adding job tentatively -- it will be properly scheduled when the scheduler starts
2026-01-15 20:19:11,355 - INFO - 📅 Full Crawler scheduled daily at 02:00
2026-01-15 20:19:11,356 - INFO - Adding job tentatively -- it will be properly scheduled when the scheduler starts
2026-01-15 20:19:11,356 - INFO -  Hybrid Crawler scheduled every 4 hours
2026-01-15 20:19:11,357 - INFO - Added job "Full Crawler Daily Job" to job store "default"
2026-01-15 20:19:11,362 - INFO - Added job "Hybrid Crawler Interval Job" to job store "default"
2026-01-15 20:19:11,362 - INFO - Scheduler started
2026-01-15 20:19:11,363 - INFO -  Scheduler started successfully
2026-01-15 20:19:11,363 - INFO - 📋 Hybrid Crawler Interval Job: next run at 2026-01-16 00:19:11.356089+07:00
2026-01-15 20:19:11,363 - INFO - 📋 Full Crawler Daily Job: next run at 2026-01-16 02:00:00+07:00
2026-01-15 20:19:11,363 - INFO - 🚀 Running initial hybrid crawler...
2026-01-15 20:19:11,363 - INFO - 🚀 Starting Hybrid Crawler job...
2026-01-15 20:19:11,363 - INFO - ====== WebDriver manager ======
2026-01-15 20:19:12,963 - INFO - Get LATEST chromedriver version for google-chrome
2026-01-15 20:19:13,877 - INFO - Get LATEST chromedriver version for google-chrome
2026-01-15 20:19:14,913 - INFO - Driver [C:\Users\admin\.wdm\drivers\chromedriver\win64\143.0.7499.192\chromedriver-win32/chromedriver.exe] found in cache
2026-01-15 20:19:16,254 - INFO - Selenium driver started
2026-01-15 20:19:16,255 - INFO - ang load trang (New posts)...
2026-01-15 20:19:22,787 - INFO - ✓ URL có pagination: https://f319.com/find-new/posts
2026-01-15 20:19:22,788 - INFO - Sử dụng URL: https://f319.com/find-new/posts
2026-01-15 20:19:22,788 - INFO - ang xử lý trang 1
2026-01-15 20:19:24,840 - INFO - Tìm thấy 20 threads trên trang 1
2026-01-15 20:19:31,143 - INFO - ã thu thập thông tin 20 threads, bắt đầu crawl posts...
2026-01-15 20:19:31,151 - INFO - [1/20] Crawl thread: BSR tin mặt 42.000 tỷ, chia cổ tức 61,5%, bóng dá...
2026-01-15 20:19:31,152 - INFO - [2/20] Crawl thread: Qcg: Ngày không xa!...
2026-01-15 20:19:34,672 - INFO - [Thread 1927427] Existing thread, crawling reverse 70→1 until last_post_id: post-47879191
2026-01-15 20:19:35,027 - INFO - [Thread 1825273] Existing thread, crawling reverse 1630→1 until last_post_id: post-47879141
2026-01-15 20:19:36,947 - INFO - [Thread 1927427] Found last_post_id at page 70, stopping...
2026-01-15 20:19:36,958 - INFO - [Thread 1927427] Final batch inserted 1/1 posts
2026-01-15 20:19:36,960 - INFO - [Thread 1927427] Collected 1 posts in 5.8s
2026-01-15 20:19:36,960 - INFO - Thu thập được 1 posts từ thread
2026-01-15 20:19:36,961 - INFO - [3/20] Crawl thread: Thiên Long Hóa Rồng?...
2026-01-15 20:19:37,268 - INFO - [Thread 1825273] Found last_post_id at page 1630, stopping...
2026-01-15 20:19:37,275 - INFO - [Thread 1825273] Final batch inserted 1/1 posts
2026-01-15 20:19:37,277 - INFO - [Thread 1825273] Collected 1 posts in 6.1s
2026-01-15 20:19:37,278 - INFO - Thu thập được 1 posts từ thread
2026-01-15 20:19:37,281 - INFO - [4/20] Crawl thread: HID sẽ lại X5 từ vùng giá 4.x ???...
2026-01-15 20:19:39,701 - INFO - [Thread 1861323] Existing thread, crawling reverse 26→1 until last_post_id: post-47877519
2026-01-15 20:19:39,830 - INFO - [Thread 1943407] Existing thread, crawling reverse 20→1 until last_post_id: post-47879207
2026-01-15 20:19:42,105 - INFO - [Thread 1943407] Found last_post_id at page 20, stopping...
2026-01-15 20:19:42,107 - INFO - [Thread 1861323] Found last_post_id at page 26, stopping...
2026-01-15 20:19:42,107 - INFO - [Thread 1943407] Collected 0 posts in 4.8s
2026-01-15 20:19:42,108 - INFO - Thu thập được 0 posts từ thread
2026-01-15 20:19:42,115 - INFO - [Thread 1861323] Final batch inserted 1/1 posts
2026-01-15 20:19:42,118 - INFO - [Thread 1861323] Collected 1 posts in 5.2s
2026-01-15 20:19:42,118 - INFO - Thu thập được 1 posts từ thread
2026-01-15 20:19:42,119 - INFO - [5/20] Crawl thread: BIDV chào bán riêng lẻ với giá 38,900 đồng/cp...
2026-01-15 20:19:42,124 - INFO - [6/20] Crawl thread: 6LON_banks(3/4 Big.Banks)Bơm máo,dùng hết ko Ae?...
2026-01-15 20:19:44,580 - INFO - [Thread 1943267] Existing thread, crawling reverse 42→1 until last_post_id: post-47879203
2026-01-15 20:19:44,583 - INFO - [Thread 1943821] Existing thread, crawling reverse 9→1 until last_post_id: post-47879205
2026-01-15 20:19:46,947 - INFO - [Thread 1943267] Found last_post_id at page 42, stopping...
2026-01-15 20:19:46,952 - INFO - [Thread 1943821] Found last_post_id at page 9, stopping...
2026-01-15 20:19:46,953 - INFO - [Thread 1943267] Collected 0 posts in 4.8s
2026-01-15 20:19:46,953 - INFO - [Thread 1943821] Collected 0 posts in 4.8s
2026-01-15 20:19:46,954 - INFO - Thu thập được 0 posts từ thread
2026-01-15 20:19:46,955 - INFO - Thu thập được 0 posts từ thread
2026-01-15 20:19:46,961 - INFO - [7/20] Crawl thread: ánh giá thị trưng!...
2026-01-15 20:19:46,961 - INFO - [8/20] Crawl thread: Ngành cao su (GVR, PHR,...) và NQ79...
2026-01-15 20:19:49,358 - INFO - [Thread 1943285] Existing thread, crawling reverse 6→1 until last_post_id: post-47879195
2026-01-15 20:19:49,366 - INFO - [Thread 1941133] Existing thread, crawling reverse 26→1 until last_post_id: post-47879197
2026-01-15 20:19:51,746 - INFO - [Thread 1943285] Found last_post_id at page 6, stopping...
2026-01-15 20:19:51,751 - INFO - [Thread 1941133] Found last_post_id at page 26, stopping...
2026-01-15 20:19:51,751 - INFO - [Thread 1943285] Collected 0 posts in 4.8s
2026-01-15 20:19:51,753 - INFO - Thu thập được 0 posts từ thread
2026-01-15 20:19:51,753 - INFO - [Thread 1941133] Collected 0 posts in 4.8s
2026-01-15 20:19:51,756 - INFO - Thu thập được 0 posts từ thread
2026-01-15 20:19:51,757 - INFO - [9/20] Crawl thread: Ngôi nhà nh trên Thảo Nguyên - P86...
2026-01-15 20:19:51,760 - INFO - [10/20] Crawl thread: HDB- Tiếp tục hành trình chinh phục những đỉnh cao...
2026-01-15 20:19:54,139 - INFO - [Thread 1942185] Existing thread, crawling reverse 527→1 until last_post_id: post-47879193
2026-01-15 20:19:54,157 - INFO - [Thread 1943915] Existing thread, crawling reverse 3→1 until last_post_id: post-47879189
2026-01-15 20:19:56,499 - INFO - [Thread 1942185] Found last_post_id at page 527, stopping...
2026-01-15 20:19:56,500 - INFO - [Thread 1942185] Collected 0 posts in 4.7s
2026-01-15 20:19:56,500 - INFO - Thu thập được 0 posts từ thread
2026-01-15 20:19:56,502 - INFO - [11/20] Crawl thread: BBC: Chia cổ tức kỷ lục 373,5%...
2026-01-15 20:19:56,795 - INFO - [Thread 1943915] Found last_post_id at page 3, stopping...
2026-01-15 20:19:56,796 - INFO - [Thread 1943915] Collected 0 posts in 5.0s
2026-01-15 20:19:56,796 - INFO - Thu thập được 0 posts từ thread
2026-01-15 20:19:56,798 - INFO - [12/20] Crawl thread: MBB đã v vùng giá mơ ước...
2026-01-15 20:19:59,118 - INFO - [Thread 1936289] Existing thread, crawling reverse 24→1 until last_post_id: post-47858815
2026-01-15 20:20:00,810 - INFO - [Thread 1943807] Existing thread, crawling reverse 4→1 until last_post_id: post-47879187
2026-01-15 20:20:01,883 - INFO - [Thread 1936289] Found last_post_id at page 24, stopping...
2026-01-15 20:20:01,884 - INFO - [Thread 1936289] Collected 0 posts in 5.1s
2026-01-15 20:20:01,885 - INFO - Thu thập được 0 posts từ thread
2026-01-15 20:20:01,891 - INFO - [13/20] Crawl thread: NNC - Siêu cổ phiếu ngành đá tăng trưởng rất mạnh ...
2026-01-15 20:20:03,100 - INFO - [Thread 1943807] Found last_post_id at page 4, stopping...
2026-01-15 20:20:03,100 - INFO - [Thread 1943807] Collected 0 posts in 6.6s
2026-01-15 20:20:03,101 - INFO - Thu thập được 0 posts từ thread
2026-01-15 20:20:03,104 - INFO - [14/20] Crawl thread: EIB mã duy nhất đi ngược thị trưng hôm nay...
2026-01-15 20:20:04,458 - INFO - [Thread 1927077] Existing thread, crawling reverse 31→1 until last_post_id: post-47868727
2026-01-15 20:20:05,706 - INFO - [Thread 1943887] Existing thread, crawling reverse 1→1 until last_post_id: post-47879157
2026-01-15 20:20:06,841 - INFO - [Thread 1927077] Found last_post_id at page 31, stopping...
2026-01-15 20:20:06,842 - INFO - [Thread 1927077] Collected 0 posts in 4.9s
2026-01-15 20:20:06,842 - INFO - Thu thập được 0 posts từ thread
2026-01-15 20:20:06,845 - INFO - [15/20] Crawl thread: Các trụ VN30 sắp tới cổ phiếu nào lên được chú ý !...
2026-01-15 20:20:08,205 - INFO - [Thread 1943887] Found last_post_id at page 1, stopping...
2026-01-15 20:20:08,206 - INFO - [Thread 1943887] Collected 0 posts in 5.1s
2026-01-15 20:20:08,207 - INFO - Thu thập được 0 posts từ thread
2026-01-15 20:20:08,209 - INFO - [16/20] Crawl thread: Thanh khoản...
2026-01-15 20:20:09,322 - INFO - [Thread 1943809] Existing thread, crawling reverse 1→1 until last_post_id: post-47879151
2026-01-15 20:20:10,561 - INFO - [Thread 1943459] Existing thread, crawling reverse 7→1 until last_post_id: post-47879149
2026-01-15 20:20:11,960 - INFO - [Thread 1943809] Found last_post_id at page 1, stopping...
2026-01-15 20:20:11,963 - INFO - [Thread 1943809] Collected 0 posts in 5.1s
2026-01-15 20:20:11,968 - INFO - Thu thập được 0 posts từ thread
2026-01-15 20:20:11,980 - INFO - [17/20] Crawl thread: Nhận định vnindex, cổ phiêu tât cả cac nho...
2026-01-15 20:20:14,049 - INFO - [Thread 1943459] Found last_post_id at page 7, stopping...
2026-01-15 20:20:14,051 - INFO - [Thread 1943459] Collected 0 posts in 5.8s
2026-01-15 20:20:14,051 - INFO - Thu thập được 0 posts từ thread
2026-01-15 20:20:14,055 - INFO - [18/20] Crawl thread: VIX: quân bài tẩy h nhà M...
2026-01-15 20:20:14,254 - INFO - [Thread 1943941] Existing thread, crawling reverse 1→1 until last_post_id: post-47879145
2026-01-15 20:20:16,356 - INFO - [Thread 1903403] Existing thread, crawling reverse 559→1 until last_post_id: post-47879137
2026-01-15 20:20:16,629 - INFO - [Thread 1943941] Found last_post_id at page 1, stopping...
2026-01-15 20:20:16,630 - INFO - [Thread 1943941] Collected 0 posts in 4.6s
2026-01-15 20:20:16,630 - INFO - Thu thập được 0 posts từ thread
2026-01-15 20:20:16,632 - INFO - [19/20] Crawl thread: Thép-ã đến lúc...
2026-01-15 20:20:18,962 - INFO - [Thread 1903403] Found last_post_id at page 559, stopping...
2026-01-15 20:20:18,963 - INFO - [Thread 1903403] Collected 0 posts in 4.9s
2026-01-15 20:20:18,963 - INFO - Thu thập được 0 posts từ thread
2026-01-15 20:20:18,965 - INFO - [20/20] Crawl thread: VSC CP Cảng biển đáng chú ý !...
2026-01-15 20:20:19,315 - INFO - [Thread 1943755] Existing thread, crawling reverse 6→1 until last_post_id: post-47879135
2026-01-15 20:20:21,567 - INFO - [Thread 1917307] Existing thread, crawling reverse 47→1 until last_post_id: post-47866603
2026-01-15 20:20:21,707 - INFO - [Thread 1943755] Found last_post_id at page 6, stopping...
2026-01-15 20:20:21,708 - INFO - [Thread 1943755] Collected 0 posts in 5.1s
2026-01-15 20:20:21,709 - INFO - Thu thập được 0 posts từ thread
2026-01-15 20:20:23,845 - INFO - [Thread 1917307] Found last_post_id at page 47, stopping...
2026-01-15 20:20:23,845 - INFO - [Thread 1917307] Collected 0 posts in 4.9s
2026-01-15 20:20:23,846 - INFO - Thu thập được 0 posts từ thread
2026-01-15 20:20:23,847 - INFO - Hoàn thành trang 1, tổng posts: 3
2026-01-15 20:20:27,919 - INFO - ang xử lý trang 2
2026-01-15 20:20:33,605 - INFO - Tìm thấy 20 threads trên trang 2
2026-01-15 20:20:40,037 - INFO - ã thu thập thông tin 20 threads, bắt đầu crawl posts...
2026-01-15 20:20:40,041 - INFO - [1/20] Crawl thread: VGS - LN Q3.25 gấp 600% so cùng kỳ, kích hoạch siê...
2026-01-15 20:20:40,042 - INFO - [2/20] Crawl thread: Game định giá lại tài sản quốc gia -------- Cá mập...
2026-01-15 20:20:42,383 - INFO - [Thread 1935865] Existing thread, crawling reverse 15→1 until last_post_id: post-47847771
2026-01-15 20:20:42,603 - INFO - [Thread 1936055] Existing thread, crawling reverse 10→1 until last_post_id: post-47876653
2026-01-15 20:20:44,708 - INFO - [Thread 1935865] Found last_post_id at page 15, stopping...
2026-01-15 20:20:44,709 - INFO - [Thread 1935865] Collected 0 posts in 4.7s
2026-01-15 20:20:44,710 - INFO - Thu thập được 0 posts từ thread
2026-01-15 20:20:44,713 - INFO - [3/20] Crawl thread: VNM – Có đang trở lại đưng đua tăng trưởng?...
2026-01-15 20:20:44,931 - INFO - [Thread 1936055] Found last_post_id at page 10, stopping...
2026-01-15 20:20:44,931 - INFO - [Thread 1936055] Collected 0 posts in 4.9s
2026-01-15 20:20:44,933 - INFO - Thu thập được 0 posts từ thread
2026-01-15 20:20:44,936 - INFO - [4/20] Crawl thread: Săn tìm cổ phiếu PENNY đột biến 2025...
2026-01-15 20:20:47,365 - INFO - [Thread 1943639] Existing thread, crawling reverse 2→1 until last_post_id: post-47877947
2026-01-15 20:20:48,029 - INFO - [Thread 1902465] Existing thread, crawling reverse 241→1 until last_post_id: post-47872883
2026-01-15 20:20:49,642 - INFO - [Thread 1943639] Found last_post_id at page 2, stopping...
2026-01-15 20:20:49,643 - INFO - [Thread 1943639] Collected 0 posts in 4.9s
2026-01-15 20:20:49,644 - INFO - Thu thập được 0 posts từ thread
2026-01-15 20:20:49,647 - INFO - [5/20] Crawl thread: Bí mật Năng lượng năng lực Quân Sự ----☆☆☆----Top ...
2026-01-15 20:20:50,398 - INFO - [Thread 1902465] Found last_post_id at page 241, stopping...
2026-01-15 20:20:50,400 - INFO - [Thread 1902465] Collected 0 posts in 5.5s
2026-01-15 20:20:50,402 - INFO - Thu thập được 0 posts từ thread
2026-01-15 20:20:50,405 - INFO - [6/20] Crawl thread: Cooking BCTC, đà tăng VIC VHM đến đâu?...
2026-01-15 20:20:52,558 - INFO - [Thread 1942595] Existing thread, crawling reverse 5→1 until last_post_id: post-47866933
2026-01-15 20:20:52,804 - INFO - [Thread 1943237] Existing thread, crawling reverse 6→1 until last_post_id: post-47869019
2026-01-15 20:20:54,954 - INFO - [Thread 1942595] Found last_post_id at page 5, stopping...
2026-01-15 20:20:54,955 - INFO - [Thread 1942595] Collected 0 posts in 5.3s
2026-01-15 20:20:54,956 - INFO - Thu thập được 0 posts từ thread
2026-01-15 20:20:54,958 - INFO - [7/20] Crawl thread: VOS-vào sóng !...
2026-01-15 20:20:55,151 - INFO - [Thread 1943237] Found last_post_id at page 6, stopping...
2026-01-15 20:20:55,152 - INFO - [Thread 1943237] Collected 0 posts in 4.7s
2026-01-15 20:20:55,153 - INFO - Thu thập được 0 posts từ thread
2026-01-15 20:20:55,156 - INFO - [8/20] Crawl thread: VEA:Tổng CT Máy động lực và máy Nông nghiệp VN- CP...
2026-01-15 20:20:57,525 - INFO - [Thread 1942127] Existing thread, crawling reverse 9→1 until last_post_id: post-47879101
2026-01-15 20:20:57,553 - INFO - [Thread 1835579] Existing thread, crawling reverse 376→1 until last_post_id: post-47879099
2026-01-15 20:20:59,864 - INFO - [Thread 1835579] Found last_post_id at page 376, stopping...
2026-01-15 20:20:59,864 - INFO - [Thread 1835579] Collected 0 posts in 4.7s
2026-01-15 20:20:59,865 - INFO - Thu thập được 0 posts từ thread
2026-01-15 20:20:59,867 - INFO - [9/20] Crawl thread: Tim năng GVR - Tập đoàn Cao su Việt Nam...
2026-01-15 20:21:00,174 - INFO - [Thread 1942127] Found last_post_id at page 9, stopping...
2026-01-15 20:21:00,176 - INFO - [Thread 1942127] Collected 0 posts in 5.2s
2026-01-15 20:21:00,176 - INFO - Thu thập được 0 posts từ thread
2026-01-15 20:21:00,181 - INFO - [10/20] Crawl thread: VNI - vươn mình 1954 or 1975...
2026-01-15 20:21:02,263 - INFO - [Thread 1582019] Existing thread, crawling reverse 68→1 until last_post_id: post-47879097
2026-01-15 20:21:02,527 - INFO - [Thread 1936901] Existing thread, crawling reverse 263→1 until last_post_id: post-47879089
2026-01-15 20:21:04,512 - INFO - [Thread 1582019] Found last_post_id at page 68, stopping...
2026-01-15 20:21:04,513 - INFO - [Thread 1582019] Collected 0 posts in 4.6s
2026-01-15 20:21:04,513 - INFO - Thu thập được 0 posts từ thread
2026-01-15 20:21:04,516 - INFO - [11/20] Crawl thread: Bđs bắt đáy...
2026-01-15 20:21:04,859 - INFO - [Thread 1936901] Found last_post_id at page 263, stopping...
2026-01-15 20:21:04,861 - INFO - [Thread 1936901] Collected 0 posts in 4.7s
2026-01-15 20:21:04,862 - INFO - Thu thập được 0 posts từ thread
2026-01-15 20:21:04,865 - INFO - [12/20] Crawl thread: VHC bước vào chu kỳ tăng trưởng...
2026-01-15 20:21:06,837 - INFO - [Thread 1940685] Existing thread, crawling reverse 51→1 until last_post_id: post-47879085
2026-01-15 20:21:07,154 - INFO - [Thread 1930571] Existing thread, crawling reverse 31→1 until last_post_id: post-47879065
2026-01-15 20:21:09,462 - INFO - [Thread 1930571] Found last_post_id at page 31, stopping...
2026-01-15 20:21:09,469 - INFO - [Thread 1940685] Found last_post_id at page 51, stopping...
2026-01-15 20:21:09,471 - INFO - [Thread 1930571] Collected 0 posts in 4.6s
2026-01-15 20:21:09,471 - INFO - [Thread 1940685] Collected 0 posts in 5.0s
2026-01-15 20:21:09,473 - INFO - Thu thập được 0 posts từ thread
2026-01-15 20:21:09,472 - INFO - Thu thập được 0 posts từ thread
2026-01-15 20:21:09,482 - INFO - [13/20] Crawl thread: Săn lùng cổ phiếu PENNY đột biến 2026!...
2026-01-15 20:21:09,482 - INFO - [14/20] Crawl thread: NVL - Những khó khăn dần được tháo gỡ...
2026-01-15 20:21:11,936 - INFO - [Thread 1943779] Existing thread, crawling reverse 7→1 until last_post_id: post-47879061
2026-01-15 20:21:11,954 - INFO - [Thread 1902473] Existing thread, crawling reverse 277→1 until last_post_id: post-47832853
2026-01-15 20:21:14,179 - INFO - [Thread 1943779] Found last_post_id at page 7, stopping...
2026-01-15 20:21:14,180 - INFO - [Thread 1943779] Collected 0 posts in 4.7s
2026-01-15 20:21:14,180 - INFO - Thu thập được 0 posts từ thread
2026-01-15 20:21:14,184 - INFO - [15/20] Crawl thread: PNJ viên kim cương sót lại mở đầu chu kỳ tăng trưở...
2026-01-15 20:21:14,301 - INFO - [Thread 1902473] Found last_post_id at page 277, stopping...
2026-01-15 20:21:14,303 - INFO - [Thread 1902473] Collected 0 posts in 4.8s
2026-01-15 20:21:14,304 - INFO - Thu thập được 0 posts từ thread
2026-01-15 20:21:14,310 - INFO - [16/20] Crawl thread: CII hưởng lợi lớn nhất đấu giá đất Thủ Thiêm...
2026-01-15 20:21:16,681 - INFO - [Thread 1940615] Existing thread, crawling reverse 20→1 until last_post_id: post-47864921
2026-01-15 20:21:16,712 - INFO - [Thread 1705091] Existing thread, crawling reverse 213→1 until last_post_id: post-47879041
2026-01-15 20:21:19,053 - INFO - [Thread 1705091] Found last_post_id at page 213, stopping...
2026-01-15 20:21:19,065 - INFO - [Thread 1705091] Collected 0 posts in 4.8s
2026-01-15 20:21:19,066 - INFO - Thu thập được 0 posts từ thread
2026-01-15 20:21:19,077 - INFO - [17/20] Crawl thread: QCG: liệu có một trận đánh lớn?...
2026-01-15 20:21:19,086 - INFO - [Thread 1940615] Found last_post_id at page 20, stopping...
2026-01-15 20:21:19,086 - INFO - [Thread 1940615] Collected 0 posts in 4.9s
2026-01-15 20:21:19,087 - INFO - Thu thập được 0 posts từ thread
2026-01-15 20:21:19,088 - INFO - [18/20] Crawl thread: VGI bùng nổ lợi nhuận 2026-2030?...
2026-01-15 20:21:21,488 - INFO - [Thread 1936621] Existing thread, crawling reverse 27→1 until last_post_id: post-47879003
2026-01-15 20:21:21,728 - INFO - [Thread 1943743] Existing thread, crawling reverse 2→1 until last_post_id: post-47879009
2026-01-15 20:21:23,787 - INFO - [Thread 1936621] Found last_post_id at page 27, stopping...
2026-01-15 20:21:23,788 - INFO - [Thread 1936621] Collected 0 posts in 4.7s
2026-01-15 20:21:23,788 - INFO - Thu thập được 0 posts từ thread
2026-01-15 20:21:23,793 - INFO - [19/20] Crawl thread: Tản mạn v CPI và TTCK (53)...
2026-01-15 20:21:24,222 - INFO - [Thread 1943743] Found last_post_id at page 2, stopping...
2026-01-15 20:21:24,224 - INFO - [Thread 1943743] Collected 0 posts in 5.1s
2026-01-15 20:21:24,224 - INFO - Thu thập được 0 posts từ thread
2026-01-15 20:21:24,227 - INFO - [20/20] Crawl thread: Ta sơn, thưởng trà….Luận phong thủy cho năm Bính ...
2026-01-15 20:21:26,173 - INFO - [Thread 1942249] Existing thread, crawling reverse 45→1 until last_post_id: post-47879001
2026-01-15 20:21:26,651 - INFO - [Thread 1942255] Existing thread, crawling reverse 146→1 until last_post_id: post-47878999
2026-01-15 20:21:28,503 - INFO - [Thread 1942249] Found last_post_id at page 45, stopping...
2026-01-15 20:21:28,505 - INFO - [Thread 1942249] Collected 0 posts in 4.7s
2026-01-15 20:21:28,505 - INFO - Thu thập được 0 posts từ thread
2026-01-15 20:21:28,963 - INFO - [Thread 1942255] Found last_post_id at page 146, stopping...
2026-01-15 20:21:28,964 - INFO - [Thread 1942255] Collected 0 posts in 4.7s
2026-01-15 20:21:28,964 - INFO - Thu thập được 0 posts từ thread
2026-01-15 20:21:28,966 - INFO - Hoàn thành trang 2, tổng posts: 3
2026-01-15 20:21:32,564 - INFO - ang xử lý trang 3
2026-01-15 20:21:38,117 - INFO - Tìm thấy 20 threads trên trang 3
2026-01-15 20:21:43,292 - INFO - ã thu thập thông tin 20 threads, bắt đầu crawl posts...
2026-01-15 20:21:43,296 - INFO - [1/20] Crawl thread: HQC số 1 NOXH...
2026-01-15 20:21:43,297 - INFO - [2/20] Crawl thread: Vinfast - Xe điện của ngưi Việt (P3)...
2026-01-15 20:21:45,615 - INFO - [Thread 1882039] Existing thread, crawling reverse 800→1 until last_post_id: post-47878987
2026-01-15 20:21:45,679 - INFO - [Thread 1920459] Existing thread, crawling reverse 1→1 until last_post_id: post-46952941
2026-01-15 20:21:47,996 - INFO - [Thread 1882039] Found last_post_id at page 800, stopping...
2026-01-15 20:21:47,997 - INFO - [Thread 1882039] Collected 0 posts in 4.7s
2026-01-15 20:21:47,998 - INFO - Thu thập được 0 posts từ thread
2026-01-15 20:21:48,002 - INFO - [3/20] Crawl thread: CII - ầu cơ gia trị vơi tài sản tỉ $ của ...
2026-01-15 20:21:48,060 - INFO - [Thread 1920459] Found last_post_id at page 1, stopping...
2026-01-15 20:21:48,061 - INFO - [Thread 1920459] Collected 0 posts in 4.8s
2026-01-15 20:21:48,061 - INFO - Thu thập được 0 posts từ thread
2026-01-15 20:21:48,063 - INFO - [4/20] Crawl thread: Xin 3 chữ cái cho năm 2026......
2026-01-15 20:21:50,330 - INFO - [Thread 1943931] Existing thread, crawling reverse 1→1 until last_post_id: post-47878977
2026-01-15 20:21:50,369 - INFO - [Thread 1923365] Existing thread, crawling reverse 168→1 until last_post_id: post-47878983
2026-01-15 20:21:52,645 - INFO - [Thread 1943931] Found last_post_id at page 1, stopping...
2026-01-15 20:21:52,645 - INFO - [Thread 1943931] Collected 0 posts in 4.6s
2026-01-15 20:21:52,645 - INFO - Thu thập được 0 posts từ thread
2026-01-15 20:21:52,648 - INFO - [5/20] Crawl thread: STB - Cổ phiếu kịch hay đang đên hồi cao trào(...
2026-01-15 20:21:52,706 - INFO - [Thread 1923365] Found last_post_id at page 168, stopping...
2026-01-15 20:21:52,708 - INFO - [Thread 1923365] Collected 0 posts in 4.7s
2026-01-15 20:21:52,709 - INFO - Thu thập được 0 posts từ thread
2026-01-15 20:21:52,712 - INFO - [6/20] Crawl thread: TPHCM KCH HOẠT "TỨ TRỤ" HẠ TẦNG 293.000 TỶ – DÒNG...
2026-01-15 20:21:55,003 - INFO - [Thread 1930607] Existing thread, crawling reverse 133→1 until last_post_id: post-47878971
2026-01-15 20:21:55,019 - INFO - [Thread 1943939] Existing thread, crawling reverse 1→1 until last_post_id: post-47878969
2026-01-15 20:21:57,327 - INFO - [Thread 1943939] Found last_post_id at page 1, stopping...
2026-01-15 20:21:57,327 - INFO - [Thread 1943939] Collected 0 posts in 4.6s
2026-01-15 20:21:57,328 - INFO - Thu thập được 0 posts từ thread
2026-01-15 20:21:57,330 - INFO - [7/20] Crawl thread: Khuyến nghị mua VIX...
2026-01-15 20:21:57,619 - INFO - [Thread 1930607] Found last_post_id at page 133, stopping...
2026-01-15 20:21:57,620 - INFO - [Thread 1930607] Collected 0 posts in 5.0s
2026-01-15 20:21:57,621 - INFO - Thu thập được 0 posts từ thread
2026-01-15 20:21:57,624 - INFO - [8/20] Crawl thread: ACV- Hình trình vượt 100k/cp bắt đầu từ đây...
2026-01-15 20:21:59,999 - INFO - [Thread 1902573] Existing thread, crawling reverse 48→1 until last_post_id: post-47878967
2026-01-15 20:22:00,010 - INFO - [Thread 1940601] Existing thread, crawling reverse 12→1 until last_post_id: post-47878957
2026-01-15 20:22:02,311 - INFO - [Thread 1940601] Found last_post_id at page 12, stopping...
2026-01-15 20:22:02,312 - INFO - [Thread 1940601] Collected 0 posts in 4.7s
2026-01-15 20:22:02,312 - INFO - Thu thập được 0 posts từ thread
2026-01-15 20:22:02,322 - INFO - [Thread 1902573] Found last_post_id at page 48, stopping...
2026-01-15 20:22:02,325 - INFO - [Thread 1902573] Collected 0 posts in 5.0s
2026-01-15 20:22:02,325 - INFO - [9/20] Crawl thread: CDP: CTCP Dược phẩm Trung ương Codupha- CP đầu tư ...
2026-01-15 20:22:02,326 - INFO - Thu thập được 0 posts từ thread
2026-01-15 20:22:02,334 - INFO - [10/20] Crawl thread: HDG lợi nhuận nghìn tỷ vượt kế hoạch 2023...
2026-01-15 20:22:04,742 - INFO - [Thread 1857501] Existing thread, crawling reverse 504→1 until last_post_id: post-47878949
2026-01-15 20:22:04,769 - INFO - [Thread 1930047] Existing thread, crawling reverse 16→1 until last_post_id: post-47860857
2026-01-15 20:22:07,064 - INFO - [Thread 1930047] Found last_post_id at page 16, stopping...
2026-01-15 20:22:07,064 - INFO - [Thread 1930047] Collected 0 posts in 4.7s
2026-01-15 20:22:07,065 - INFO - Thu thập được 0 posts từ thread
2026-01-15 20:22:07,067 - INFO - [11/20] Crawl thread: Sau siêu phẩm BID > Tiếp đến HPG đạt điu kiện XAN...
2026-01-15 20:22:07,106 - INFO - [Thread 1857501] Found last_post_id at page 504, stopping...
2026-01-15 20:22:07,108 - INFO - [Thread 1857501] Collected 0 posts in 4.8s
2026-01-15 20:22:07,108 - INFO - Thu thập được 0 posts từ thread
2026-01-15 20:22:07,111 - INFO - [12/20] Crawl thread: POW tăng vốn khủng có lập đỉnh mới...
2026-01-15 20:22:09,449 - INFO - [Thread 1943825] Existing thread, crawling reverse 1→1 until last_post_id: post-47878941
2026-01-15 20:22:09,482 - INFO - [Thread 1935387] Existing thread, crawling reverse 12→1 until last_post_id: post-47878925
2026-01-15 20:22:11,784 - INFO - [Thread 1943825] Found last_post_id at page 1, stopping...
2026-01-15 20:22:11,786 - INFO - [Thread 1943825] Collected 0 posts in 4.7s
2026-01-15 20:22:11,787 - INFO - Thu thập được 0 posts từ thread
2026-01-15 20:22:11,790 - INFO - [13/20] Crawl thread: SSI - điểm yếu ngắn hạn của dòng chứng khoán...
2026-01-15 20:22:12,148 - INFO - [Thread 1935387] Found last_post_id at page 12, stopping...
2026-01-15 20:22:12,150 - INFO - [Thread 1935387] Collected 0 posts in 5.0s
2026-01-15 20:22:12,151 - INFO - Thu thập được 0 posts từ thread
2026-01-15 20:22:12,153 - INFO - [14/20] Crawl thread: VCB – Mô hình “Cốc và Tay Cầm đang hình thành?...
2026-01-15 20:22:14,126 - INFO - [Thread 1926403] Existing thread, crawling reverse 29→1 until last_post_id: post-47870185
2026-01-15 20:22:14,472 - INFO - [Thread 1933181] Existing thread, crawling reverse 2→1 until last_post_id: post-47878921
2026-01-15 20:22:16,508 - INFO - [Thread 1926403] Found last_post_id at page 29, stopping...
2026-01-15 20:22:16,510 - INFO - [Thread 1926403] Collected 0 posts in 4.7s
2026-01-15 20:22:16,510 - INFO - Thu thập được 0 posts từ thread
2026-01-15 20:22:16,514 - INFO - [15/20] Crawl thread: Tập hợp cổ đông HVG- Công Ty Thuỷ Sản Hùng Vương...
2026-01-15 20:22:16,765 - INFO - [Thread 1933181] Found last_post_id at page 2, stopping...
2026-01-15 20:22:16,766 - INFO - [Thread 1933181] Collected 0 posts in 4.6s
2026-01-15 20:22:16,767 - INFO - Thu thập được 0 posts từ thread
2026-01-15 20:22:16,771 - INFO - [16/20] Crawl thread: PHR - Sắp nhận đn bù 2-3k tỷ từ Thaco...
2026-01-15 20:22:18,823 - INFO - [Thread 1887673] Existing thread, crawling reverse 3→1 until last_post_id: post-46255775
2026-01-15 20:22:19,264 - INFO - [Thread 1918203] Existing thread, crawling reverse 240→1 until last_post_id: post-47878881
2026-01-15 20:22:21,091 - INFO - [Thread 1887673] Found last_post_id at page 3, stopping...
2026-01-15 20:22:21,091 - INFO - [Thread 1887673] Collected 0 posts in 4.6s
2026-01-15 20:22:21,092 - INFO - Thu thập được 0 posts từ thread
2026-01-15 20:22:21,093 - INFO - [17/20] Crawl thread: Tất cả các dòng sông đu chảy - P2...
2026-01-15 20:22:21,585 - INFO - [Thread 1918203] Found last_post_id at page 240, stopping...
2026-01-15 20:22:21,586 - INFO - [Thread 1918203] Collected 0 posts in 4.8s
2026-01-15 20:22:21,587 - INFO - Thu thập được 0 posts từ thread
2026-01-15 20:22:21,589 - INFO - [18/20] Crawl thread: DVN lên được bao nhiêu mi ngưi...
2026-01-15 20:22:23,364 - INFO - [Thread 1934311] Existing thread, crawling reverse 102→1 until last_post_id: post-47878879
2026-01-15 20:22:23,916 - INFO - [Thread 1943935] Existing thread, crawling reverse 1→1 until last_post_id: post-47878841
2026-01-15 20:22:25,726 - INFO - [Thread 1934311] Found last_post_id at page 102, stopping...
2026-01-15 20:22:25,726 - INFO - [Thread 1934311] Collected 0 posts in 4.6s
2026-01-15 20:22:25,726 - INFO - Thu thập được 0 posts từ thread
2026-01-15 20:22:25,728 - INFO - [19/20] Crawl thread: HPG- Sự trở lại của nhà Vua...
2026-01-15 20:22:26,141 - INFO - [Thread 1943935] Found last_post_id at page 1, stopping...
2026-01-15 20:22:26,143 - INFO - [Thread 1943935] Collected 0 posts in 4.6s
2026-01-15 20:22:26,144 - INFO - Thu thập được 0 posts từ thread
2026-01-15 20:22:26,147 - INFO - [20/20] Crawl thread: SZL-có xứng đáng để đầu tư?...
2026-01-15 20:22:28,461 - INFO - [Thread 1925045] Existing thread, crawling reverse 266→1 until last_post_id: post-47878835
2026-01-15 20:22:28,524 - INFO - [Thread 1293301] Existing thread, crawling reverse 752→1 until last_post_id: post-47878833
2026-01-15 20:22:30,769 - INFO - [Thread 1925045] Found last_post_id at page 266, stopping...
2026-01-15 20:22:30,771 - INFO - [Thread 1925045] Collected 0 posts in 5.0s
2026-01-15 20:22:30,772 - INFO - Thu thập được 0 posts từ thread
2026-01-15 20:22:30,820 - INFO - [Thread 1293301] Found last_post_id at page 752, stopping...
2026-01-15 20:22:30,822 - INFO - [Thread 1293301] Collected 0 posts in 4.7s
2026-01-15 20:22:30,823 - INFO - Thu thập được 0 posts từ thread
2026-01-15 20:22:30,826 - INFO - Hoàn thành trang 3, tổng posts: 3
2026-01-15 20:22:38,565 - INFO - ang xử lý trang 4
2026-01-15 20:22:44,383 - INFO - Tìm thấy 20 threads trên trang 4
2026-01-15 20:22:49,433 - INFO - ã thu thập thông tin 20 threads, bắt đầu crawl posts...
2026-01-15 20:22:49,438 - INFO - [1/20] Crawl thread: 14.1 không nên phức tạp quá - múc là có ăn...
2026-01-15 20:22:49,439 - INFO - [2/20] Crawl thread: Game mới SHB. Múc mạnh để mua nhà mua xe...
2026-01-15 20:22:51,865 - INFO - [Thread 1900397] Existing thread, crawling reverse 536→1 until last_post_id: post-47878817
2026-01-15 20:22:51,886 - INFO - [Thread 1943725] Existing thread, crawling reverse 6→1 until last_post_id: post-47878829
2026-01-15 20:22:54,139 - INFO - [Thread 1900397] Found last_post_id at page 536, stopping...
2026-01-15 20:22:54,139 - INFO - [Thread 1900397] Collected 0 posts in 4.7s
2026-01-15 20:22:54,140 - INFO - Thu thập được 0 posts từ thread
2026-01-15 20:22:54,143 - INFO - [3/20] Crawl thread: TTN - DN viễn thông vốn hoá 200 tỷ và hợp đồng gần...
2026-01-15 20:22:54,776 - INFO - [Thread 1943725] Found last_post_id at page 6, stopping...
2026-01-15 20:22:54,777 - INFO - [Thread 1943725] Collected 0 posts in 5.3s
2026-01-15 20:22:54,778 - INFO - Thu thập được 0 posts từ thread
2026-01-15 20:22:54,784 - INFO - [4/20] Crawl thread: CTI có gì?...
2026-01-15 20:22:56,870 - INFO - [Thread 1303829] Existing thread, crawling reverse 72→1 until last_post_id: post-47878815
2026-01-15 20:22:57,552 - INFO - [Thread 1911395] Existing thread, crawling reverse 39→1 until last_post_id: post-47878813
2026-01-15 20:22:59,272 - INFO - [Thread 1303829] Found last_post_id at page 72, stopping...
2026-01-15 20:22:59,274 - INFO - [Thread 1303829] Collected 0 posts in 5.1s
2026-01-15 20:22:59,275 - INFO - Thu thập được 0 posts từ thread
2026-01-15 20:22:59,278 - INFO - [5/20] Crawl thread: Công ty vốn hoá 900 tỷ tin mặt 3000 tỷ...
2026-01-15 20:22:59,841 - INFO - [Thread 1911395] Found last_post_id at page 39, stopping...
2026-01-15 20:22:59,845 - INFO - [Thread 1911395] Collected 0 posts in 5.1s
2026-01-15 20:22:59,846 - INFO - Thu thập được 0 posts từ thread
2026-01-15 20:22:59,852 - INFO - [6/20] Crawl thread: Topic cổ đông dài hạn Nhiệt điện Quảng Ninh - ầu ...
2026-01-15 20:23:01,671 - INFO - [Thread 1902081] Existing thread, crawling reverse 20→1 until last_post_id: post-47878809
2026-01-15 20:23:02,246 - INFO - [Thread 1943359] Existing thread, crawling reverse 2→1 until last_post_id: post-47878803
2026-01-15 20:23:04,062 - INFO - [Thread 1902081] Found last_post_id at page 20, stopping...
2026-01-15 20:23:04,063 - INFO - [Thread 1902081] Collected 0 posts in 4.8s
2026-01-15 20:23:04,063 - INFO - Thu thập được 0 posts từ thread
2026-01-15 20:23:04,066 - INFO - [7/20] Crawl thread: FOC - Viên kim cương bị lãng quên - Trỗi dậy cùng ...
2026-01-15 20:23:04,572 - INFO - [Thread 1943359] Found last_post_id at page 2, stopping...
2026-01-15 20:23:04,573 - INFO - [Thread 1943359] Collected 0 posts in 4.7s
2026-01-15 20:23:04,574 - INFO - Thu thập được 0 posts từ thread
2026-01-15 20:23:04,580 - INFO - [8/20] Crawl thread: Sóng Uptrend tốt nhất chu kỳ dự kiến 2026 +3-6 thá...
2026-01-15 20:23:06,528 - INFO - [Thread 1912015] Existing thread, crawling reverse 13→1 until last_post_id: post-47878789
2026-01-15 20:23:07,283 - INFO - [Thread 1942299] Existing thread, crawling reverse 23→1 until last_post_id: post-47878781
2026-01-15 20:23:08,967 - INFO - [Thread 1912015] Found last_post_id at page 13, stopping...
2026-01-15 20:23:08,968 - INFO - [Thread 1912015] Collected 0 posts in 4.9s
2026-01-15 20:23:08,969 - INFO - Thu thập được 0 posts từ thread
2026-01-15 20:23:08,972 - INFO - [9/20] Crawl thread: Làm gì có sóng cổ phiếu ngân hàng lúc này…...
2026-01-15 20:23:09,546 - INFO - [Thread 1942299] Found last_post_id at page 23, stopping...
2026-01-15 20:23:09,547 - INFO - [Thread 1942299] Collected 0 posts in 5.0s
2026-01-15 20:23:09,547 - INFO - Thu thập được 0 posts từ thread
2026-01-15 20:23:09,551 - INFO - [10/20] Crawl thread: Các cổ phiếu nhà nước cầm trên 80% mà giá chưa tăn...
2026-01-15 20:23:11,662 - INFO - [Thread 1943823] Existing thread, crawling reverse 7→1 until last_post_id: post-47878749
2026-01-15 20:23:13,951 - INFO - [Thread 1943823] Found last_post_id at page 7, stopping...
2026-01-15 20:23:13,951 - INFO - [Thread 1943823] Collected 0 posts in 5.0s
2026-01-15 20:23:13,952 - INFO - Thu thập được 0 posts từ thread
2026-01-15 20:23:13,954 - INFO - [11/20] Crawl thread: 2026: Dự ỉnh 1960- áy 1340. Cơ hội nào cho NT...
2026-01-15 20:23:15,588 - INFO - [Thread 1943905] Existing thread, crawling reverse 2→1 until last_post_id: post-47877865
2026-01-15 20:23:16,378 - INFO - [Thread 1942323] Existing thread, crawling reverse 31→1 until last_post_id: post-47878221
2026-01-15 20:23:17,889 - INFO - [Thread 1943905] Found last_post_id at page 2, stopping...
2026-01-15 20:23:17,891 - INFO - [Thread 1943905] Collected 0 posts in 8.3s
2026-01-15 20:23:17,894 - INFO - Thu thập được 0 posts từ thread
2026-01-15 20:23:17,898 - INFO - [12/20] Crawl thread: 15/1 bắt đáy...
2026-01-15 20:23:18,775 - INFO - [Thread 1942323] Found last_post_id at page 31, stopping...
2026-01-15 20:23:18,776 - INFO - [Thread 1942323] Collected 0 posts in 4.8s
2026-01-15 20:23:18,776 - INFO - Thu thập được 0 posts từ thread
2026-01-15 20:23:18,780 - INFO - [13/20] Crawl thread: VCI target 41.5, 44.5, 47.5...hết sóng 52 - 58...
2026-01-15 20:23:20,293 - INFO - [Thread 1943867] Existing thread, crawling reverse 3→1 until last_post_id: post-47878601
2026-01-15 20:23:21,437 - INFO - [Thread 1943853] Existing thread, crawling reverse 3→1 until last_post_id: post-47878595
2026-01-15 20:23:22,879 - INFO - [Thread 1943867] Found last_post_id at page 3, stopping...
2026-01-15 20:23:22,880 - INFO - [Thread 1943867] Collected 0 posts in 5.0s
2026-01-15 20:23:22,881 - INFO - Thu thập được 0 posts từ thread
2026-01-15 20:23:22,884 - INFO - [14/20] Crawl thread: Gía mục tiêu cp ……..siêu sóng ….siêu sóng……….....
2026-01-15 20:23:23,685 - INFO - [Thread 1943853] Found last_post_id at page 3, stopping...
2026-01-15 20:23:23,686 - INFO - [Thread 1943853] Collected 0 posts in 4.9s
2026-01-15 20:23:23,686 - INFO - Thu thập được 0 posts từ thread
2026-01-15 20:23:23,689 - INFO - [15/20] Crawl thread: BID: Tăng một mạch 7 phiên 40%...
2026-01-15 20:23:25,191 - INFO - [Thread 1943745] Existing thread, crawling reverse 2→1 until last_post_id: post-47878583
2026-01-15 20:23:26,225 - INFO - [Thread 1943741] Existing thread, crawling reverse 1→1 until last_post_id: post-47878569
2026-01-15 20:23:27,529 - INFO - [Thread 1943745] Found last_post_id at page 2, stopping...
2026-01-15 20:23:27,530 - INFO - [Thread 1943745] Collected 0 posts in 4.6s
2026-01-15 20:23:27,530 - INFO - Thu thập được 0 posts từ thread
2026-01-15 20:23:27,533 - INFO - [16/20] Crawl thread: Lạm bàn v Cảng à Nẵng - CDN...
2026-01-15 20:23:28,853 - INFO - [Thread 1943741] Found last_post_id at page 1, stopping...
2026-01-15 20:23:28,854 - INFO - [Thread 1943741] Collected 0 posts in 5.2s
2026-01-15 20:23:28,855 - INFO - Thu thập được 0 posts từ thread
2026-01-15 20:23:28,858 - INFO - [17/20] Crawl thread: THG-Những nốt thăng trầm...
2026-01-15 20:23:29,964 - INFO - [Thread 1883213] Existing thread, crawling reverse 28→1 until last_post_id: post-47878553
2026-01-15 20:23:31,317 - INFO - [Thread 1924015] Existing thread, crawling reverse 94→1 until last_post_id: post-47878551
2026-01-15 20:23:32,572 - INFO - [Thread 1883213] Found last_post_id at page 28, stopping...
2026-01-15 20:23:32,573 - INFO - [Thread 1883213] Collected 0 posts in 5.0s
2026-01-15 20:23:32,574 - INFO - Thu thập được 0 posts từ thread
2026-01-15 20:23:32,578 - INFO - [18/20] Crawl thread: DCM - Liên tục phá đỉnh 2025-2026...
2026-01-15 20:23:33,639 - INFO - [Thread 1924015] Found last_post_id at page 94, stopping...
2026-01-15 20:23:33,641 - INFO - [Thread 1924015] Collected 0 posts in 4.8s
2026-01-15 20:23:33,642 - INFO - Thu thập được 0 posts từ thread
2026-01-15 20:23:33,645 - INFO - [19/20] Crawl thread: VNM Cơ hội đang rất rõ ràng !...
2026-01-15 20:23:34,912 - INFO - [Thread 1929137] Existing thread, crawling reverse 53→1 until last_post_id: post-47878547
2026-01-15 20:23:36,243 - INFO - [Thread 1926367] Existing thread, crawling reverse 175→1 until last_post_id: post-47878521
2026-01-15 20:23:37,215 - INFO - [Thread 1929137] Found last_post_id at page 53, stopping...
2026-01-15 20:23:37,217 - INFO - [Thread 1929137] Collected 0 posts in 4.6s
2026-01-15 20:23:37,217 - INFO - Thu thập được 0 posts từ thread
2026-01-15 20:23:37,221 - INFO - [20/20] Crawl thread: Index Ký Sự - P3...
2026-01-15 20:23:38,492 - INFO - [Thread 1926367] Found last_post_id at page 175, stopping...
2026-01-15 20:23:38,492 - INFO - [Thread 1926367] Collected 0 posts in 4.8s
2026-01-15 20:23:38,493 - INFO - Thu thập được 0 posts từ thread
2026-01-15 20:23:39,901 - INFO - [Thread 1942309] Existing thread, crawling reverse 7→1 until last_post_id: post-47878535
2026-01-15 20:23:43,063 - INFO - [Thread 1942309] Found last_post_id at page 7, stopping...
2026-01-15 20:23:43,063 - INFO - [Thread 1942309] Collected 0 posts in 5.8s
2026-01-15 20:23:43,064 - INFO - Thu thập được 0 posts từ thread
2026-01-15 20:23:43,066 - INFO - Hoàn thành trang 4, tổng posts: 3
2026-01-15 20:23:46,637 - INFO - ang xử lý trang 5
2026-01-15 20:23:52,385 - INFO - Tìm thấy 20 threads trên trang 5
2026-01-15 20:23:58,121 - INFO - ã thu thập thông tin 20 threads, bắt đầu crawl posts...
2026-01-15 20:23:58,128 - INFO - [1/20] Crawl thread: List thoái vốn SCIC update...
2026-01-15 20:23:58,128 - INFO - [2/20] Crawl thread: Nghành Dầu khí sẽ dẫn sóng cho năm 2026?...
2026-01-15 20:24:00,868 - INFO - [Thread 1942541] Existing thread, crawling reverse 5→1 until last_post_id: post-47878507
2026-01-15 20:24:02,249 - INFO - [Thread 1943921] Existing thread, crawling reverse 1→1 until last_post_id: post-47877983
2026-01-15 20:24:03,133 - INFO - [Thread 1942541] Found last_post_id at page 5, stopping...
2026-01-15 20:24:03,133 - INFO - [Thread 1942541] Collected 0 posts in 5.0s
2026-01-15 20:24:03,135 - INFO - Thu thập được 0 posts từ thread
2026-01-15 20:24:03,137 - INFO - [3/20] Crawl thread: DGC con hào kinh tế...
2026-01-15 20:24:04,534 - INFO - [Thread 1943921] Found last_post_id at page 1, stopping...
2026-01-15 20:24:04,535 - INFO - [Thread 1943921] Collected 0 posts in 6.4s
2026-01-15 20:24:04,535 - INFO - Thu thập được 0 posts từ thread
2026-01-15 20:24:04,537 - INFO - [4/20] Crawl thread: Căng đét...
2026-01-15 20:24:05,740 - INFO - [Thread 1943403] Existing thread, crawling reverse 5→1 until last_post_id: post-47878459
2026-01-15 20:24:06,804 - INFO - [Thread 1943929] Existing thread, crawling reverse 1→1 until last_post_id: post-47878457
2026-01-15 20:24:08,034 - INFO - [Thread 1943403] Found last_post_id at page 5, stopping...
2026-01-15 20:24:08,034 - INFO - [Thread 1943403] Collected 0 posts in 4.9s
2026-01-15 20:24:08,034 - INFO - Thu thập được 0 posts từ thread
2026-01-15 20:24:08,036 - INFO - [5/20] Crawl thread: Cuối năm 2025, thoát xu hướng tích luỹ...
2026-01-15 20:24:09,043 - INFO - [Thread 1943929] Found last_post_id at page 1, stopping...
2026-01-15 20:24:09,044 - INFO - [Thread 1943929] Collected 0 posts in 4.5s
2026-01-15 20:24:09,045 - INFO - Thu thập được 0 posts từ thread
2026-01-15 20:24:09,047 - INFO - [6/20] Crawl thread: EVF Doanh nghiệp tăng trưởng...
2026-01-15 20:24:10,345 - INFO - [Thread 1936049] Existing thread, crawling reverse 8→1 until last_post_id: post-47878445
2026-01-15 20:24:11,357 - INFO - [Thread 1935667] Existing thread, crawling reverse 4→1 until last_post_id: post-47878423
2026-01-15 20:24:12,814 - INFO - [Thread 1936049] Found last_post_id at page 8, stopping...
2026-01-15 20:24:12,815 - INFO - [Thread 1936049] Collected 0 posts in 4.8s
2026-01-15 20:24:12,815 - INFO - Thu thập được 0 posts từ thread
2026-01-15 20:24:12,818 - INFO - [7/20] Crawl thread: Tam tấu SSI - VIX - CTS ! Siêu game bom tấn!...
2026-01-15 20:24:13,638 - INFO - [Thread 1935667] Found last_post_id at page 4, stopping...
2026-01-15 20:24:13,639 - INFO - [Thread 1935667] Collected 0 posts in 4.6s
2026-01-15 20:24:13,640 - INFO - Thu thập được 0 posts từ thread
2026-01-15 20:24:13,643 - INFO - [8/20] Crawl thread: Dòng tin lan toả bước sang năm 2026...
2026-01-15 20:24:15,416 - INFO - [Thread 1923417] Existing thread, crawling reverse 296→1 until last_post_id: post-47878409
2026-01-15 20:24:15,943 - INFO - [Thread 1942743] Existing thread, crawling reverse 6→1 until last_post_id: post-47878399
2026-01-15 20:24:17,684 - INFO - [Thread 1923417] Found last_post_id at page 296, stopping...
2026-01-15 20:24:17,685 - INFO - [Thread 1923417] Collected 0 posts in 4.9s
2026-01-15 20:24:17,685 - INFO - Thu thập được 0 posts từ thread
2026-01-15 20:24:17,687 - INFO - [9/20] Crawl thread: HAG - sắp sang trang mới cổ phiếu vươn mình tăng t...
2026-01-15 20:24:18,195 - INFO - [Thread 1942743] Found last_post_id at page 6, stopping...
2026-01-15 20:24:18,198 - INFO - [Thread 1942743] Collected 0 posts in 4.6s
2026-01-15 20:24:18,199 - INFO - Thu thập được 0 posts từ thread
2026-01-15 20:24:18,203 - INFO - [10/20] Crawl thread: PGV - Khủng long ngành điện...
2026-01-15 20:24:20,049 - INFO - [Thread 1935815] Existing thread, crawling reverse 105→1 until last_post_id: post-47878379
2026-01-15 20:24:20,913 - INFO - [Thread 1550217] Existing thread, crawling reverse 253→1 until last_post_id: post-47878345
2026-01-15 20:24:22,336 - INFO - [Thread 1935815] Found last_post_id at page 105, stopping...
2026-01-15 20:24:22,337 - INFO - [Thread 1935815] Collected 0 posts in 4.6s
2026-01-15 20:24:22,337 - INFO - Thu thập được 0 posts từ thread
2026-01-15 20:24:22,340 - INFO - [11/20] Crawl thread: NT2 - Góc nhìn v giá trị!!!...
2026-01-15 20:24:23,421 - INFO - [Thread 1550217] Found last_post_id at page 253, stopping...
2026-01-15 20:24:23,423 - INFO - [Thread 1550217] Collected 0 posts in 5.2s
2026-01-15 20:24:23,426 - INFO - Thu thập được 0 posts từ thread
2026-01-15 20:24:23,431 - INFO - [12/20] Crawl thread: HNG Hướng tới vùng 20...
2026-01-15 20:24:24,939 - INFO - [Thread 1935045] Existing thread, crawling reverse 6→1 until last_post_id: post-47878307
2026-01-15 20:24:25,821 - INFO - [Thread 1910241] Existing thread, crawling reverse 149→1 until last_post_id: post-47878235
2026-01-15 20:24:27,227 - INFO - [Thread 1935045] Found last_post_id at page 6, stopping...
2026-01-15 20:24:27,228 - INFO - [Thread 1935045] Collected 0 posts in 4.9s
2026-01-15 20:24:27,228 - INFO - Thu thập được 0 posts từ thread
2026-01-15 20:24:27,231 - INFO - [13/20] Crawl thread: ISH vs GHC – Cổ tức bằng tin ổn định và trn đi!...
2026-01-15 20:24:28,422 - INFO - [Thread 1910241] Found last_post_id at page 149, stopping...
2026-01-15 20:24:28,424 - INFO - [Thread 1910241] Collected 0 posts in 5.0s
2026-01-15 20:24:28,425 - INFO - Thu thập được 0 posts từ thread
2026-01-15 20:24:28,428 - INFO - [14/20] Crawl thread: VNM đạt lợi nhuận hơn +19%, gặp gỡ trực tiếp chuyê...
2026-01-15 20:24:29,676 - INFO - [Thread 1844081] Existing thread, crawling reverse 44→1 until last_post_id: post-47878229
2026-01-15 20:24:30,706 - INFO - [Thread 1943891] Existing thread, crawling reverse 1→1 until last_post_id: post-47877171
2026-01-15 20:24:31,962 - INFO - [Thread 1844081] Found last_post_id at page 44, stopping...
2026-01-15 20:24:31,963 - INFO - [Thread 1844081] Collected 0 posts in 4.7s
2026-01-15 20:24:31,964 - INFO - Thu thập được 0 posts từ thread
2026-01-15 20:24:31,968 - INFO - [15/20] Crawl thread: Nhận định thị trưng hàng ngày...
2026-01-15 20:24:32,990 - INFO - [Thread 1943891] Found last_post_id at page 1, stopping...
2026-01-15 20:24:32,991 - INFO - [Thread 1943891] Collected 0 posts in 4.6s
2026-01-15 20:24:32,991 - INFO - Thu thập được 0 posts từ thread
2026-01-15 20:24:32,995 - INFO - [16/20] Crawl thread: Vĩ mô ngành BS – Cơn bão lớn hay chỉ là khó khăn ...
2026-01-15 20:24:34,362 - INFO - [Thread 1806081] Existing thread, crawling reverse 122→1 until last_post_id: post-47878143
2026-01-15 20:24:35,587 - INFO - [Thread 1940867] Existing thread, crawling reverse 2→1 until last_post_id: post-47878133
2026-01-15 20:24:36,720 - INFO - [Thread 1806081] Found last_post_id at page 122, stopping...
2026-01-15 20:24:36,724 - INFO - [Thread 1806081] Collected 0 posts in 4.8s
2026-01-15 20:24:36,725 - INFO - Thu thập được 0 posts từ thread
2026-01-15 20:24:36,728 - INFO - [17/20] Crawl thread: Bất động sản...đến gi bắt đáy...
2026-01-15 20:24:37,849 - INFO - [Thread 1940867] Found last_post_id at page 2, stopping...
2026-01-15 20:24:37,850 - INFO - [Thread 1940867] Collected 0 posts in 4.9s
2026-01-15 20:24:37,850 - INFO - Thu thập được 0 posts từ thread
2026-01-15 20:24:37,853 - INFO - [18/20] Crawl thread: PVC - ơn vị số 1 trong mảng bảo dưỡng !...
2026-01-15 20:24:39,038 - INFO - [Thread 1943193] Existing thread, crawling reverse 5→1 until last_post_id: post-47877167
2026-01-15 20:24:40,156 - INFO - [Thread 1880851] Existing thread, crawling reverse 13→1 until last_post_id: post-47878105
2026-01-15 20:24:41,320 - INFO - [Thread 1943193] Found last_post_id at page 5, stopping...
2026-01-15 20:24:41,321 - INFO - [Thread 1943193] Collected 0 posts in 4.6s
2026-01-15 20:24:41,321 - INFO - Thu thập được 0 posts từ thread
2026-01-15 20:24:41,324 - INFO - [19/20] Crawl thread: PVC – Kỳ vng trở thành đơn vị số 1 trong mảng bảo...
2026-01-15 20:24:42,515 - INFO - [Thread 1880851] Found last_post_id at page 13, stopping...
2026-01-15 20:24:42,516 - INFO - [Thread 1880851] Collected 0 posts in 4.7s
2026-01-15 20:24:42,516 - INFO - Thu thập được 0 posts từ thread
2026-01-15 20:24:42,518 - INFO - [20/20] Crawl thread: Cổ phiếu VEA: Triển vng đầu tư như thế nào trong ...
2026-01-15 20:24:44,002 - INFO - [Thread 1943841] Existing thread, crawling reverse 1→1 until last_post_id: post-47878087
2026-01-15 20:24:44,760 - INFO - [Thread 1902277] Existing thread, crawling reverse 1→1 until last_post_id: post-47878067
2026-01-15 20:24:46,477 - INFO - [Thread 1943841] Found last_post_id at page 1, stopping...
2026-01-15 20:24:46,479 - INFO - [Thread 1943841] Collected 0 posts in 5.2s
2026-01-15 20:24:46,480 - INFO - Thu thập được 0 posts từ thread
2026-01-15 20:24:47,128 - INFO - [Thread 1902277] Found last_post_id at page 1, stopping...
2026-01-15 20:24:47,128 - INFO - [Thread 1902277] Collected 0 posts in 4.6s
2026-01-15 20:24:47,129 - INFO - Thu thập được 0 posts từ thread
2026-01-15 20:24:47,131 - INFO - Hoàn thành trang 5, tổng posts: 3
2026-01-15 20:24:54,308 - INFO - ang xử lý trang 6
2026-01-15 20:25:04,365 - WARNING - Không tìm thấy nút next tại trang 6
2026-01-15 20:25:06,691 - INFO - Selenium driver stopped
2026-01-15 20:25:06,692 - INFO - Hoàn tất! Tổng cộng thu thập: 3 posts
2026-01-15 20:25:06,692 - INFO - ✅ Hybrid Crawler completed: 3 posts in 355.3s
2026-01-15 20:25:06,693 - INFO - 📊 Summary: 100 threads (0 new)
2026-01-15 20:25:06,698 - INFO - 🔄 Scheduler is running. Press Ctrl+C to stop.
2026-01-15 20:38:15,242 - INFO - Received signal 2, shutting down...
2026-01-15 20:38:15,243 - INFO - Scheduler has been shut down
2026-01-15 20:38:15,243 - INFO - 🛑 Scheduler stopped
